single-node/miopen/config/gfx942130.HIP.3_4_0_983e058f8.ufdb.txt
16-33-136-240-1x2x2-3072-33-68-120-1-0x0x0-1x2x2-1x1x1-0-NCDHW-BF16-F=ConvHipImplicitGemm3DGroupFwdXdlops:3.99981,1689317376,miopenConvolutionFwdAlgoImplicitGEMM;GemmFwdRest:0.91227,34467840,miopenConvolutionFwdAlgoGEMM;ConvDirectNaiveConvFwd:56.185,0,miopenConvolutionFwdAlgoDirect
16-33-68-120-1x2x2-3072-33-34-60-1-0x0x0-1x2x2-1x1x1-0-NCDHW-BF16-F=ConvHipImplicitGemm3DGroupFwdXdlops:1.01219,422624256,miopenConvolutionFwdAlgoImplicitGEMM;GemmFwdRest:0.236307,8616960,miopenConvolutionFwdAlgoGEMM;ConvDirectNaiveConvFwd:13.2215,0,miopenConvolutionFwdAlgoDirect
16-33-90-160-1x2x2-3072-33-45-80-1-0x0x0-1x2x2-1x1x1-0-NCDHW-BF16-F=ConvHipImplicitGemm3DGroupFwdXdlops:1.99307,745506816,miopenConvolutionFwdAlgoImplicitGEMM;GemmFwdRest:0.432715,15206400,miopenConvolutionFwdAlgoGEMM;ConvDirectNaiveConvFwd:23.6062,0,miopenConvolutionFwdAlgoDirect
16-65-136-240-1x2x2-3072-65-68-120-1-0x0x0-1x2x2-1x1x1-0-NCDHW-BF16-F=ConvHipImplicitGemm3DGroupFwdXdlops:9.33452,3327062016,miopenConvolutionFwdAlgoImplicitGEMM;GemmFwdRest:1.83385,67891200,miopenConvolutionFwdAlgoGEMM;ConvDirectNaiveConvFwd:110.688,0,miopenConvolutionFwdAlgoDirect
16-65-68-120-1x2x2-3072-65-34-60-1-0x0x0-1x2x2-1x1x1-0-NCDHW-BF16-F=ConvHipImplicitGemm3DGroupFwdXdlops:1.91738,832060416,miopenConvolutionFwdAlgoImplicitGEMM;GemmFwdRest:0.508286,16972800,miopenConvolutionFwdAlgoGEMM;ConvDirectNaiveConvFwd:26.9245,0,miopenConvolutionFwdAlgoDirect
16-65-90-160-1x2x2-3072-65-45-80-1-0x0x0-1x2x2-1x1x1-0-NCDHW-BF16-F=ConvHipImplicitGemm3DGroupFwdXdlops:4.19802,1468041216,miopenConvolutionFwdAlgoImplicitGEMM;GemmFwdRest:0.871893,29952000,miopenConvolutionFwdAlgoGEMM;ConvDirectNaiveConvFwd:49.0898,0,miopenConvolutionFwdAlgoDirect
16-33-68-120-1x2x2-3072-33-34-60-16-0x0x0-1x2x2-1x1x1-0-NCDHW-BF16-F=ConvHipImplicitGemm3DGroupFwdXdlops:15.3552,6756089856,miopenConvolutionFwdAlgoImplicitGEMM;GemmFwdRest:3.71765,8616960,miopenConvolutionFwdAlgoGEMM;ConvDirectNaiveConvFwd:186.527,0,miopenConvolutionFwdAlgoDirect
16-33-90-160-1x2x2-3072-33-45-80-16-0x0x0-1x2x2-1x1x1-0-NCDHW-BF16-F=ConvHipImplicitGemm3DGroupFwdXdlops:31.3325,11922210816,miopenConvolutionFwdAlgoImplicitGEMM;GemmFwdRest:6.70797,15206400,miopenConvolutionFwdAlgoGEMM;ConvDirectNaiveConvFwd:336.02,0,miopenConvolutionFwdAlgoDirect
16-33-136-240-1x2x2-3072-33-68-120-4-0x0x0-1x2x2-1x1x1-0-NCDHW-BF16-F=ConvHipImplicitGemm3DGroupFwdXdlops:15.9,6756089856,miopenConvolutionFwdAlgoImplicitGEMM;GemmFwdRest:3.53338,34467840,miopenConvolutionFwdAlgoGEMM;ConvDirectNaiveConvFwd:197.979,0,miopenConvolutionFwdAlgoDirect
16-33-68-120-1x2x2-3072-33-34-60-4-0x0x0-1x2x2-1x1x1-0-NCDHW-BF16-F=ConvHipImplicitGemm3DGroupFwdXdlops:3.85009,1689317376,miopenConvolutionFwdAlgoImplicitGEMM;GemmFwdRest:0.937864,8616960,miopenConvolutionFwdAlgoGEMM;ConvDirectNaiveConvFwd:48.3177,0,miopenConvolutionFwdAlgoDirect
16-33-90-160-1x2x2-3072-33-45-80-4-0x0x0-1x2x2-1x1x1-0-NCDHW-BF16-F=ConvHipImplicitGemm3DGroupFwdXdlops:7.74008,2980847616,miopenConvolutionFwdAlgoImplicitGEMM;GemmFwdRest:1.76676,15206400,miopenConvolutionFwdAlgoGEMM;ConvDirectNaiveConvFwd:85.2133,0,miopenConvolutionFwdAlgoDirect
16-65-136-240-1x2x2-3072-65-68-120-4-0x0x0-1x2x2-1x1x1-0-NCDHW-BF16-F=ConvHipImplicitGemm3DGroupFwdXdlops:36.679,13307068416,miopenConvolutionFwdAlgoImplicitGEMM;GemmFwdRest:6.94623,67891200,miopenConvolutionFwdAlgoGEMM;ConvDirectNaiveConvFwd:420.622,0,miopenConvolutionFwdAlgoDirect
16-65-68-120-1x2x2-3072-65-34-60-4-0x0x0-1x2x2-1x1x1-0-NCDHW-BF16-F=ConvHipImplicitGemm3DGroupFwdXdlops:7.58472,3327062016,miopenConvolutionFwdAlgoImplicitGEMM;GemmFwdRest:2.0686,16972800,miopenConvolutionFwdAlgoGEMM;ConvDirectNaiveConvFwd:96.6056,0,miopenConvolutionFwdAlgoDirect
16-65-90-160-1x2x2-3072-65-45-80-4-0x0x0-1x2x2-1x1x1-0-NCDHW-BF16-F=ConvHipImplicitGemm3DGroupFwdXdlops:16.6097,5870985216,miopenConvolutionFwdAlgoImplicitGEMM;GemmFwdRest:3.39509,29952000,miopenConvolutionFwdAlgoGEMM;ConvDirectNaiveConvFwd:172.435,0,miopenConvolutionFwdAlgoDirect
16-33-68-120-1x2x2-3072-33-34-60-8-0x0x0-1x2x2-1x1x1-0-NCDHW-BF16-F=ConvHipImplicitGemm3DGroupFwdXdlops:7.65332,3378241536,miopenConvolutionFwdAlgoImplicitGEMM;GemmFwdRest:1.9015,8616960,miopenConvolutionFwdAlgoGEMM;ConvDirectNaiveConvFwd:94.1841,0,miopenConvolutionFwdAlgoDirect
16-33-90-160-1x2x2-3072-33-45-80-8-0x0x0-1x2x2-1x1x1-0-NCDHW-BF16-F=ConvHipImplicitGemm3DGroupFwdXdlops:15.38,5961302016,miopenConvolutionFwdAlgoImplicitGEMM;GemmFwdRest:3.39703,15206400,miopenConvolutionFwdAlgoGEMM;ConvDirectNaiveConvFwd:166.475,0,miopenConvolutionFwdAlgoDirect
16-65-68-120-1x2x2-3072-65-34-60-8-0x0x0-1x2x2-1x1x1-0-NCDHW-BF16-F=ConvHipImplicitGemm3DGroupFwdXdlops:15.25,6653730816,miopenConvolutionFwdAlgoImplicitGEMM;GemmFwdRest:4.01485,16972800,miopenConvolutionFwdAlgoGEMM;ConvDirectNaiveConvFwd:188.227,0,miopenConvolutionFwdAlgoDirect
128-11-130-194-3x3x3-128-9-128-192-1-0x0x0-1x1x1-1x1x1-0-NCDHW-FP16-F=ConvHipImplicitGemm3DGroupFwdXdlops:0.615155,128527360,miopenConvolutionFwdAlgoImplicitGEMM;GemmFwdRest:3.41961,1528823808,miopenConvolutionFwdAlgoGEMM;ConvDirectNaiveConvFwd:594.461,0,miopenConvolutionFwdAlgoDirect
128-11-130-194-3x3x3-3-9-128-192-1-0x0x0-1x1x1-1x1x1-0-NCDHW-FP16-F=ConvHipImplicitGemm3DGroupFwdXdlops:2.02574,72367360,miopenConvolutionFwdAlgoImplicitGEMM;GemmFwdRest:3.32711,1528823808,miopenConvolutionFwdAlgoGEMM;ConvDirectNaiveConvFwd:615.629,0,miopenConvolutionFwdAlgoDirect
128-11-130-258-3x3x3-128-9-128-256-1-0x0x0-1x1x1-1x1x1-0-NCDHW-FP16-F=ConvHipImplicitGemm3DGroupFwdXdlops:0.808944,170830848,miopenConvolutionFwdAlgoImplicitGEMM;GemmFwdRest:4.92626,2038431744,miopenConvolutionFwdAlgoGEMM;ConvDirectNaiveConvFwd:763.662,0,miopenConvolutionFwdAlgoDirect
128-11-130-258-3x3x3-3-9-128-256-1-0x0x0-1x1x1-1x1x1-0-NCDHW-FP16-F=ConvHipImplicitGemm3DGroupFwdXdlops:0.719681,96238848,miopenConvolutionFwdAlgoImplicitGEMM;GemmFwdRest:4.62461,2038431744,miopenConvolutionFwdAlgoGEMM;ConvDirectNaiveConvFwd:771.598,0,miopenConvolutionFwdAlgoDirect
128-11-146-130-3x3x3-128-9-144-128-1-0x0x0-1x1x1-1x1x1-0-NCDHW-FP16-F=ConvHipImplicitGemm3DGroupFwdXdlops:0.510861,96799744,miopenConvolutionFwdAlgoImplicitGEMM;GemmFwdRest:2.6771,1146617856,miopenConvolutionFwdAlgoGEMM;ConvDirectNaiveConvFwd:454.12,0,miopenConvolutionFwdAlgoDirect
128-11-146-130-3x3x3-3-9-144-128-1-0x0x0-1x1x1-1x1x1-0-NCDHW-FP16-F=ConvHipImplicitGemm3DGroupFwdXdlops:1.63624,54463744,miopenConvolutionFwdAlgoImplicitGEMM;GemmFwdRest:2.56141,1146617856,miopenConvolutionFwdAlgoGEMM;ConvDirectNaiveConvFwd:461.855,0,miopenConvolutionFwdAlgoDirect
128-11-146-258-3x3x3-128-9-144-256-1-0x0x0-1x1x1-1x1x1-0-NCDHW-FP16-F=ConvHipImplicitGemm3DGroupFwdXdlops:0.904636,191892480,miopenConvolutionFwdAlgoImplicitGEMM;GemmFwdRest:5.60818,2293235712,miopenConvolutionFwdAlgoGEMM;ConvDirectNaiveConvFwd:860.163,0,miopenConvolutionFwdAlgoDirect
128-11-146-258-3x3x3-3-9-144-256-1-0x0x0-1x1x1-1x1x1-0-NCDHW-FP16-F=ConvHipImplicitGemm3DGroupFwdXdlops:0.815497,108084480,miopenConvolutionFwdAlgoImplicitGEMM;GemmFwdRest:5.21825,2293235712,miopenConvolutionFwdAlgoGEMM;ConvDirectNaiveConvFwd:872.702,0,miopenConvolutionFwdAlgoDirect
128-11-162-194-3x3x3-128-9-160-192-1-0x0x0-1x1x1-1x1x1-0-NCDHW-FP16-F=ConvHipImplicitGemm3DGroupFwdXdlops:0.844384,160164864,miopenConvolutionFwdAlgoImplicitGEMM;GemmFwdRest:4.70816,1911029760,miopenConvolutionFwdAlgoGEMM;ConvDirectNaiveConvFwd:751.711,0,miopenConvolutionFwdAlgoDirect
128-11-162-194-3x3x3-3-9-160-192-1-0x0x0-1x1x1-1x1x1-0-NCDHW-FP16-F=ConvHipImplicitGemm3DGroupFwdXdlops:0.515904,90180864,miopenConvolutionFwdAlgoImplicitGEMM;GemmFwdRest:4.32464,1911029760,miopenConvolutionFwdAlgoGEMM;ConvDirectNaiveConvFwd:769.505,0,miopenConvolutionFwdAlgoDirect
128-11-162-258-3x3x3-128-9-160-256-1-0x0x0-1x1x1-1x1x1-0-NCDHW-FP16-F=ConvHipImplicitGemm3DGroupFwdXdlops:0.99231,212954112,miopenConvolutionFwdAlgoImplicitGEMM;GemmFwdRest:6.2659,2548039680,miopenConvolutionFwdAlgoGEMM;ConvDirectNaiveConvFwd:955.269,0,miopenConvolutionFwdAlgoDirect
128-11-162-258-3x3x3-3-9-160-256-1-0x0x0-1x1x1-1x1x1-0-NCDHW-FP16-F=ConvHipImplicitGemm3DGroupFwdXdlops:0.970019,119930112,miopenConvolutionFwdAlgoImplicitGEMM;GemmFwdRest:5.94856,2548039680,miopenConvolutionFwdAlgoGEMM;ConvDirectNaiveConvFwd:970.922,0,miopenConvolutionFwdAlgoDirect
128-11-258-130-3x3x3-128-9-256-128-1-0x0x0-1x1x1-1x1x1-0-NCDHW-FP16-F=ConvHipImplicitGemm3DGroupFwdXdlops:0.779954,170830848,miopenConvolutionFwdAlgoImplicitGEMM;GemmFwdRest:4.96159,2038431744,miopenConvolutionFwdAlgoGEMM;ConvDirectNaiveConvFwd:801.948,0,miopenConvolutionFwdAlgoDirect
128-11-258-130-3x3x3-3-9-256-128-1-0x0x0-1x1x1-1x1x1-0-NCDHW-FP16-F=ConvHipImplicitGemm3DGroupFwdXdlops:0.553721,96238848,miopenConvolutionFwdAlgoImplicitGEMM;GemmFwdRest:4.62373,2038431744,miopenConvolutionFwdAlgoGEMM;ConvDirectNaiveConvFwd:822.08,0,miopenConvolutionFwdAlgoDirect
128-11-258-194-3x3x3-128-9-256-192-1-0x0x0-1x1x1-1x1x1-0-NCDHW-FP16-F=ConvHipImplicitGemm3DGroupFwdXdlops:1.17445,255077376,miopenConvolutionFwdAlgoImplicitGEMM;GemmFwdRest:7.53793,3057647616,miopenConvolutionFwdAlgoGEMM;ConvDirectNaiveConvFwd:1200.83,0,miopenConvolutionFwdAlgoDirect
128-11-258-194-3x3x3-3-9-256-192-1-0x0x0-1x1x1-1x1x1-0-NCDHW-FP16-F=ConvHipImplicitGemm3DGroupFwdXdlops:0.883042,143621376,miopenConvolutionFwdAlgoImplicitGEMM;GemmFwdRest:7.07222,3057647616,miopenConvolutionFwdAlgoGEMM;ConvDirectNaiveConvFwd:1227.46,0,miopenConvolutionFwdAlgoDirect
128-11-258-258-3x3x3-128-9-256-256-1-0x0x0-1x1x1-1x1x1-0-NCDHW-FP16-F=ConvHipImplicitGemm3DGroupFwdXdlops:1.61188,339323904,miopenConvolutionFwdAlgoImplicitGEMM;GemmFwdRest:9.94893,4076863488,miopenConvolutionFwdAlgoGEMM;ConvDirectNaiveConvFwd:1533.83,0,miopenConvolutionFwdAlgoDirect
128-11-258-258-3x3x3-3-9-256-256-1-0x0x0-1x1x1-1x1x1-0-NCDHW-FP16-F=ConvHipImplicitGemm3DGroupFwdXdlops:1.33988,191003904,miopenConvolutionFwdAlgoImplicitGEMM;GemmFwdRest:9.368,4076863488,miopenConvolutionFwdAlgoGEMM;ConvDirectNaiveConvFwd:1554.08,0,miopenConvolutionFwdAlgoDirect
128-19-130-194-3x3x3-128-17-128-192-1-0x0x0-1x1x1-1x1x1-0-NCDHW-FP16-F=ConvHipImplicitGemm3DGroupFwdXdlops:1.10305,230509568,miopenConvolutionFwdAlgoImplicitGEMM;GemmFwdRest:7.22559,2887778304,miopenConvolutionFwdAlgoGEMM;ConvDirectNaiveConvFwd:1136.75,0,miopenConvolutionFwdAlgoDirect
128-19-130-194-3x3x3-3-17-128-192-1-0x0x0-1x1x1-1x1x1-0-NCDHW-FP16-F=ConvHipImplicitGemm3DGroupFwdXdlops:3.34605,125197568,miopenConvolutionFwdAlgoImplicitGEMM;GemmFwdRest:6.82508,2887778304,miopenConvolutionFwdAlgoGEMM;ConvDirectNaiveConvFwd:1160.81,0,miopenConvolutionFwdAlgoDirect
128-19-130-258-3x3x3-128-17-128-256-1-0x0x0-1x1x1-1x1x1-0-NCDHW-FP16-F=ConvHipImplicitGemm3DGroupFwdXdlops:1.50468,306629632,miopenConvolutionFwdAlgoImplicitGEMM;GemmFwdRest:9.61718,3850371072,miopenConvolutionFwdAlgoGEMM;ConvDirectNaiveConvFwd:1446.95,0,miopenConvolutionFwdAlgoDirect
128-19-130-258-3x3x3-3-17-128-256-1-0x0x0-1x1x1-1x1x1-0-NCDHW-FP16-F=ConvHipImplicitGemm3DGroupFwdXdlops:1.31792,166501632,miopenConvolutionFwdAlgoImplicitGEMM;GemmFwdRest:9.07188,3850371072,miopenConvolutionFwdAlgoGEMM;ConvDirectNaiveConvFwd:1463.22,0,miopenConvolutionFwdAlgoDirect
128-19-146-130-3x3x3-128-17-144-128-1-0x0x0-1x1x1-1x1x1-0-NCDHW-FP16-F=ConvHipImplicitGemm3DGroupFwdXdlops:0.829577,173419520,miopenConvolutionFwdAlgoImplicitGEMM;GemmFwdRest:5.30157,2165833728,miopenConvolutionFwdAlgoGEMM;ConvDirectNaiveConvFwd:857.051,0,miopenConvolutionFwdAlgoDirect
128-19-146-130-3x3x3-3-17-144-128-1-0x0x0-1x1x1-1x1x1-0-NCDHW-FP16-F=ConvHipImplicitGemm3DGroupFwdXdlops:0.510394,94219520,miopenConvolutionFwdAlgoImplicitGEMM;GemmFwdRest:4.96041,2165833728,miopenConvolutionFwdAlgoGEMM;ConvDirectNaiveConvFwd:874.027,0,miopenConvolutionFwdAlgoDirect
128-19-146-258-3x3x3-128-17-144-256-1-0x0x0-1x1x1-1x1x1-0-NCDHW-FP16-F=ConvHipImplicitGemm3DGroupFwdXdlops:1.67878,344534016,miopenConvolutionFwdAlgoImplicitGEMM;GemmFwdRest:10.8079,4331667456,miopenConvolutionFwdAlgoGEMM;ConvDirectNaiveConvFwd:1636.56,0,miopenConvolutionFwdAlgoDirect
128-19-146-258-3x3x3-3-17-144-256-1-0x0x0-1x1x1-1x1x1-0-NCDHW-FP16-F=ConvHipImplicitGemm3DGroupFwdXdlops:1.37983,186998016,miopenConvolutionFwdAlgoImplicitGEMM;GemmFwdRest:10.2331,4331667456,miopenConvolutionFwdAlgoGEMM;ConvDirectNaiveConvFwd:1649.91,0,miopenConvolutionFwdAlgoDirect
128-19-162-194-3x3x3-128-17-160-192-1-0x0x0-1x1x1-1x1x1-0-NCDHW-FP16-F=ConvHipImplicitGemm3DGroupFwdXdlops:1.34143,287443968,miopenConvolutionFwdAlgoImplicitGEMM;GemmFwdRest:9.05641,3609722880,miopenConvolutionFwdAlgoGEMM;ConvDirectNaiveConvFwd:1422.63,0,miopenConvolutionFwdAlgoDirect
128-19-162-194-3x3x3-3-17-160-192-1-0x0x0-1x1x1-1x1x1-0-NCDHW-FP16-F=ConvHipImplicitGemm3DGroupFwdXdlops:4.11153,156019968,miopenConvolutionFwdAlgoImplicitGEMM;GemmFwdRest:8.55221,3609722880,miopenConvolutionFwdAlgoGEMM;ConvDirectNaiveConvFwd:1456.98,0,miopenConvolutionFwdAlgoDirect
128-19-162-258-3x3x3-128-17-160-256-1-0x0x0-1x1x1-1x1x1-0-NCDHW-FP16-F=ConvHipImplicitGemm3DGroupFwdXdlops:1.9014,382438400,miopenConvolutionFwdAlgoImplicitGEMM;GemmFwdRest:11.9738,4812963840,miopenConvolutionFwdAlgoGEMM;ConvDirectNaiveConvFwd:1824.78,0,miopenConvolutionFwdAlgoDirect
128-19-162-258-3x3x3-3-17-160-256-1-0x0x0-1x1x1-1x1x1-0-NCDHW-FP16-F=ConvHipImplicitGemm3DGroupFwdXdlops:1.49996,207494400,miopenConvolutionFwdAlgoImplicitGEMM;GemmFwdRest:11.3765,4812963840,miopenConvolutionFwdAlgoGEMM;ConvDirectNaiveConvFwd:1835.49,0,miopenConvolutionFwdAlgoDirect
128-19-258-130-3x3x3-128-17-256-128-1-0x0x0-1x1x1-1x1x1-0-NCDHW-FP16-F=ConvHipImplicitGemm3DGroupFwdXdlops:1.4842,306629632,miopenConvolutionFwdAlgoImplicitGEMM;GemmFwdRest:9.60622,3850371072,miopenConvolutionFwdAlgoGEMM;ConvDirectNaiveConvFwd:1530.94,0,miopenConvolutionFwdAlgoDirect
128-19-258-130-3x3x3-3-17-256-128-1-0x0x0-1x1x1-1x1x1-0-NCDHW-FP16-F=ConvHipImplicitGemm3DGroupFwdXdlops:1.00532,166501632,miopenConvolutionFwdAlgoImplicitGEMM;GemmFwdRest:9.06208,3850371072,miopenConvolutionFwdAlgoGEMM;ConvDirectNaiveConvFwd:1555.68,0,miopenConvolutionFwdAlgoDirect
128-19-258-194-3x3x3-128-17-256-192-1-0x0x0-1x1x1-1x1x1-0-NCDHW-FP16-F=ConvHipImplicitGemm3DGroupFwdXdlops:2.28156,458247168,miopenConvolutionFwdAlgoImplicitGEMM;GemmFwdRest:14.7078,5775556608,miopenConvolutionFwdAlgoGEMM;ConvDirectNaiveConvFwd:2279.76,0,miopenConvolutionFwdAlgoDirect
128-19-258-194-3x3x3-3-17-256-192-1-0x0x0-1x1x1-1x1x1-0-NCDHW-FP16-F=ConvHipImplicitGemm3DGroupFwdXdlops:1.42793,248487168,miopenConvolutionFwdAlgoImplicitGEMM;GemmFwdRest:13.8863,5775556608,miopenConvolutionFwdAlgoGEMM;ConvDirectNaiveConvFwd:2330.34,0,miopenConvolutionFwdAlgoDirect
128-19-258-258-3x3x3-128-17-256-256-1-0x0x0-1x1x1-1x1x1-0-NCDHW-FP16-F=ConvHipImplicitGemm3DGroupFwdXdlops:3.26661,609864704,miopenConvolutionFwdAlgoImplicitGEMM;ConvDirectNaiveConvFwd:2921.82,0,miopenConvolutionFwdAlgoDirect
128-19-258-258-3x3x3-3-17-256-256-1-0x0x0-1x1x1-1x1x1-0-NCDHW-FP16-F=ConvHipImplicitGemm3DGroupFwdXdlops:2.22807,330472704,miopenConvolutionFwdAlgoImplicitGEMM;ConvDirectNaiveConvFwd:2952.22,0,miopenConvolutionFwdAlgoDirect
128-7-130-194-3x3x3-128-5-128-192-1-0x0x0-1x1x1-1x1x1-0-NCDHW-FP16-F=ConvHipImplicitGemm3DGroupFwdXdlops:0.377153,77536256,miopenConvolutionFwdAlgoImplicitGEMM;GemmFwdRest:1.9469,849346560,miopenConvolutionFwdAlgoGEMM;ConvDirectNaiveConvFwd:331.199,0,miopenConvolutionFwdAlgoDirect
128-7-130-194-3x3x3-3-5-128-192-1-0x0x0-1x1x1-1x1x1-0-NCDHW-FP16-F=ConvHipImplicitGemm3DGroupFwdXdlops:0.215747,45952256,miopenConvolutionFwdAlgoImplicitGEMM;GemmFwdRest:1.90813,849346560,miopenConvolutionFwdAlgoGEMM;ConvDirectNaiveConvFwd:342.549,0,miopenConvolutionFwdAlgoDirect
128-7-130-258-3x3x3-128-5-128-256-1-0x0x0-1x1x1-1x1x1-0-NCDHW-FP16-F=ConvHipImplicitGemm3DGroupFwdXdlops:0.502155,102931456,miopenConvolutionFwdAlgoImplicitGEMM;GemmFwdRest:2.70309,1132462080,miopenConvolutionFwdAlgoGEMM;ConvDirectNaiveConvFwd:422.63,0,miopenConvolutionFwdAlgoDirect
128-7-130-258-3x3x3-3-5-128-256-1-0x0x0-1x1x1-1x1x1-0-NCDHW-FP16-F=ConvHipImplicitGemm3DGroupFwdXdlops:0.468847,61107456,miopenConvolutionFwdAlgoImplicitGEMM;GemmFwdRest:2.53909,1132462080,miopenConvolutionFwdAlgoGEMM;ConvDirectNaiveConvFwd:428.768,0,miopenConvolutionFwdAlgoDirect
128-7-146-130-3x3x3-128-5-144-128-1-0x0x0-1x1x1-1x1x1-0-NCDHW-FP16-F=ConvHipImplicitGemm3DGroupFwdXdlops:0.293304,58489856,miopenConvolutionFwdAlgoImplicitGEMM;GemmFwdRest:1.45664,637009920,miopenConvolutionFwdAlgoGEMM;ConvDirectNaiveConvFwd:253.004,0,miopenConvolutionFwdAlgoDirect
128-7-146-130-3x3x3-3-5-144-128-1-0x0x0-1x1x1-1x1x1-0-NCDHW-FP16-F=ConvHipImplicitGemm3DGroupFwdXdlops:0.868062,34585856,miopenConvolutionFwdAlgoImplicitGEMM;GemmFwdRest:1.36484,637009920,miopenConvolutionFwdAlgoGEMM;ConvDirectNaiveConvFwd:256.88,0,miopenConvolutionFwdAlgoDirect
128-7-146-258-3x3x3-128-5-144-256-1-0x0x0-1x1x1-1x1x1-0-NCDHW-FP16-F=ConvHipImplicitGemm3DGroupFwdXdlops:0.492771,115571712,miopenConvolutionFwdAlgoImplicitGEMM;GemmFwdRest:2.92681,1274019840,miopenConvolutionFwdAlgoGEMM;ConvDirectNaiveConvFwd:476.8,0,miopenConvolutionFwdAlgoDirect
128-7-146-258-3x3x3-3-5-144-256-1-0x0x0-1x1x1-1x1x1-0-NCDHW-FP16-F=ConvHipImplicitGemm3DGroupFwdXdlops:1.68548,68627712,miopenConvolutionFwdAlgoImplicitGEMM;GemmFwdRest:2.80823,1274019840,miopenConvolutionFwdAlgoGEMM;ConvDirectNaiveConvFwd:481.995,0,miopenConvolutionFwdAlgoDirect
128-7-162-194-3x3x3-128-5-160-192-1-0x0x0-1x1x1-1x1x1-0-NCDHW-FP16-F=ConvHipImplicitGemm3DGroupFwdXdlops:0.424412,96525312,miopenConvolutionFwdAlgoImplicitGEMM;GemmFwdRest:2.4488,1061683200,miopenConvolutionFwdAlgoGEMM;ConvDirectNaiveConvFwd:407.233,0,miopenConvolutionFwdAlgoDirect
128-7-162-194-3x3x3-3-5-160-192-1-0x0x0-1x1x1-1x1x1-0-NCDHW-FP16-F=ConvHipImplicitGemm3DGroupFwdXdlops:0.27465,57261312,miopenConvolutionFwdAlgoImplicitGEMM;GemmFwdRest:2.33338,1061683200,miopenConvolutionFwdAlgoGEMM;ConvDirectNaiveConvFwd:428.742,0,miopenConvolutionFwdAlgoDirect
128-7-162-258-3x3x3-128-5-160-256-1-0x0x0-1x1x1-1x1x1-0-NCDHW-FP16-F=ConvHipImplicitGemm3DGroupFwdXdlops:0.598201,128211968,miopenConvolutionFwdAlgoImplicitGEMM;GemmFwdRest:3.19707,1415577600,miopenConvolutionFwdAlgoGEMM;ConvDirectNaiveConvFwd:530.537,0,miopenConvolutionFwdAlgoDirect
128-7-162-258-3x3x3-3-5-160-256-1-0x0x0-1x1x1-1x1x1-0-NCDHW-FP16-F=ConvHipImplicitGemm3DGroupFwdXdlops:0.600858,76147968,miopenConvolutionFwdAlgoImplicitGEMM;GemmFwdRest:3.09038,1415577600,miopenConvolutionFwdAlgoGEMM;ConvDirectNaiveConvFwd:538.028,0,miopenConvolutionFwdAlgoDirect
128-7-258-130-3x3x3-128-5-256-128-1-0x0x0-1x1x1-1x1x1-0-NCDHW-FP16-F=ConvHipImplicitGemm3DGroupFwdXdlops:0.554281,102931456,miopenConvolutionFwdAlgoImplicitGEMM;GemmFwdRest:2.6356,1132462080,miopenConvolutionFwdAlgoGEMM;ConvDirectNaiveConvFwd:446.617,0,miopenConvolutionFwdAlgoDirect
128-7-258-130-3x3x3-3-5-256-128-1-0x0x0-1x1x1-1x1x1-0-NCDHW-FP16-F=ConvHipImplicitGemm3DGroupFwdXdlops:1.61301,61107456,miopenConvolutionFwdAlgoImplicitGEMM;GemmFwdRest:2.53471,1132462080,miopenConvolutionFwdAlgoGEMM;ConvDirectNaiveConvFwd:455.931,0,miopenConvolutionFwdAlgoDirect
128-7-258-194-3x3x3-128-5-256-192-1-0x0x0-1x1x1-1x1x1-0-NCDHW-FP16-F=ConvHipImplicitGemm3DGroupFwdXdlops:0.71561,153492480,miopenConvolutionFwdAlgoImplicitGEMM;GemmFwdRest:4.05349,1698693120,miopenConvolutionFwdAlgoGEMM;ConvDirectNaiveConvFwd:667.388,0,miopenConvolutionFwdAlgoDirect
128-7-258-194-3x3x3-3-5-256-192-1-0x0x0-1x1x1-1x1x1-0-NCDHW-FP16-F=ConvHipImplicitGemm3DGroupFwdXdlops:2.1216,91188480,miopenConvolutionFwdAlgoImplicitGEMM;GemmFwdRest:3.75764,1698693120,miopenConvolutionFwdAlgoGEMM;ConvDirectNaiveConvFwd:686.779,0,miopenConvolutionFwdAlgoDirect
128-7-258-258-3x3x3-128-5-256-256-1-0x0x0-1x1x1-1x1x1-0-NCDHW-FP16-F=ConvHipImplicitGemm3DGroupFwdXdlops:0.943362,204053504,miopenConvolutionFwdAlgoImplicitGEMM;GemmFwdRest:5.52371,2264924160,miopenConvolutionFwdAlgoGEMM;ConvDirectNaiveConvFwd:849.939,0,miopenConvolutionFwdAlgoDirect
128-7-258-258-3x3x3-3-5-256-256-1-0x0x0-1x1x1-1x1x1-0-NCDHW-FP16-F=ConvHipImplicitGemm3DGroupFwdXdlops:0.780276,121269504,miopenConvolutionFwdAlgoImplicitGEMM;GemmFwdRest:5.11148,2264924160,miopenConvolutionFwdAlgoGEMM;ConvDirectNaiveConvFwd:862.075,0,miopenConvolutionFwdAlgoDirect
16-2-16-24-1x1x1-16-2-16-24-1-0x0x0-1x1x1-1x1x1-0-NCDHW-FP16-F=ConvHipImplicitGemm3DGroupFwdXdlops:0.0288514,49664,miopenConvolutionFwdAlgoImplicitGEMM;GemmFwd1x1_0_1:0.00652,0,miopenConvolutionFwdAlgoGEMM;ConvDirectNaiveConvFwd:0.0216286,0,miopenConvolutionFwdAlgoDirect
16-2-16-32-1x1x1-16-2-16-32-1-0x0x0-1x1x1-1x1x1-0-NCDHW-FP16-F=ConvHipImplicitGemm3DGroupFwdXdlops:0.0288402,66048,miopenConvolutionFwdAlgoImplicitGEMM;GemmFwd1x1_0_1:0.00606025,0,miopenConvolutionFwdAlgoGEMM;ConvDirectNaiveConvFwd:0.02762,0,miopenConvolutionFwdAlgoDirect
16-2-18-16-1x1x1-16-2-18-16-1-0x0x0-1x1x1-1x1x1-0-NCDHW-FP16-F=ConvHipImplicitGemm3DGroupFwdXdlops:0.0277316,37376,miopenConvolutionFwdAlgoImplicitGEMM;GemmFwd1x1_0_1:0.00554,0,miopenConvolutionFwdAlgoGEMM;ConvDirectNaiveConvFwd:0.0214,0,miopenConvolutionFwdAlgoDirect
16-2-18-32-1x1x1-16-2-18-32-1-0x0x0-1x1x1-1x1x1-0-NCDHW-FP16-F=ConvHipImplicitGemm3DGroupFwdXdlops:0.027864,74240,miopenConvolutionFwdAlgoImplicitGEMM;GemmFwd1x1_0_1:0.00774,0,miopenConvolutionFwdAlgoGEMM;ConvDirectNaiveConvFwd:0.0339314,0,miopenConvolutionFwdAlgoDirect
16-2-20-24-1x1x1-16-2-20-24-1-0x0x0-1x1x1-1x1x1-0-NCDHW-FP16-F=ConvHipImplicitGemm3DGroupFwdXdlops:0.0287042,61952,miopenConvolutionFwdAlgoImplicitGEMM;GemmFwd1x1_0_1:0.00611333,0,miopenConvolutionFwdAlgoGEMM;ConvDirectNaiveConvFwd:0.0275943,0,miopenConvolutionFwdAlgoDirect
16-2-20-32-1x1x1-16-2-20-32-1-0x0x0-1x1x1-1x1x1-0-NCDHW-FP16-F=ConvHipImplicitGemm3DGroupFwdXdlops:0.029472,82432,miopenConvolutionFwdAlgoImplicitGEMM;GemmFwd1x1_0_1:0.00797333,0,miopenConvolutionFwdAlgoGEMM;ConvDirectNaiveConvFwd:0.03436,0,miopenConvolutionFwdAlgoDirect
16-2-32-16-1x1x1-16-2-32-16-1-0x0x0-1x1x1-1x1x1-0-NCDHW-FP16-F=ConvHipImplicitGemm3DGroupFwdXdlops:0.0278,66048,miopenConvolutionFwdAlgoImplicitGEMM;GemmFwd1x1_0_1:0.00746667,0,miopenConvolutionFwdAlgoGEMM;ConvDirectNaiveConvFwd:0.0277143,0,miopenConvolutionFwdAlgoDirect
16-2-32-24-1x1x1-16-2-32-24-1-0x0x0-1x1x1-1x1x1-0-NCDHW-FP16-F=ConvHipImplicitGemm3DGroupFwdXdlops:0.02856,98816,miopenConvolutionFwdAlgoImplicitGEMM;GemmFwd1x1_0_1:0.00601,0,miopenConvolutionFwdAlgoGEMM;ConvDirectNaiveConvFwd:0.0404114,0,miopenConvolutionFwdAlgoDirect
16-2-32-32-1x1x1-16-2-32-32-1-0x0x0-1x1x1-1x1x1-0-NCDHW-FP16-F=ConvHipImplicitGemm3DGroupFwdXdlops:0.0282737,131584,miopenConvolutionFwdAlgoImplicitGEMM;GemmFwd1x1_0_1:0.00834,0,miopenConvolutionFwdAlgoGEMM;ConvDirectNaiveConvFwd:0.0530743,0,miopenConvolutionFwdAlgoDirect
16-3-16-24-1x1x1-16-3-16-24-1-0x0x0-1x1x1-1x1x1-0-NCDHW-FP16-F=ConvHipImplicitGemm3DGroupFwdXdlops:0.0285467,74240,miopenConvolutionFwdAlgoImplicitGEMM;GemmFwd1x1_0_1:0.00594667,0,miopenConvolutionFwdAlgoGEMM;ConvDirectNaiveConvFwd:0.03396,0,miopenConvolutionFwdAlgoDirect
16-3-16-32-1x1x1-16-3-16-32-1-0x0x0-1x1x1-1x1x1-0-NCDHW-FP16-F=ConvHipImplicitGemm3DGroupFwdXdlops:0.031408,98816,miopenConvolutionFwdAlgoImplicitGEMM;GemmFwd1x1_0_1:0.00601333,0,miopenConvolutionFwdAlgoGEMM;ConvDirectNaiveConvFwd:0.0403886,0,miopenConvolutionFwdAlgoDirect
16-3-18-16-1x1x1-16-3-18-16-1-0x0x0-1x1x1-1x1x1-0-NCDHW-FP16-F=ConvHipImplicitGemm3DGroupFwdXdlops:0.0285333,55808,miopenConvolutionFwdAlgoImplicitGEMM;GemmFwd1x1_0_1:0.00568,0,miopenConvolutionFwdAlgoGEMM;ConvDirectNaiveConvFwd:0.0275371,0,miopenConvolutionFwdAlgoDirect
16-3-18-32-1x1x1-16-3-18-32-1-0x0x0-1x1x1-1x1x1-0-NCDHW-FP16-F=ConvHipImplicitGemm3DGroupFwdXdlops:0.0280335,111104,miopenConvolutionFwdAlgoImplicitGEMM;GemmFwd1x1_0_1:0.00736667,0,miopenConvolutionFwdAlgoGEMM;ConvDirectNaiveConvFwd:0.0468171,0,miopenConvolutionFwdAlgoDirect
16-3-20-24-1x1x1-16-3-20-24-1-0x0x0-1x1x1-1x1x1-0-NCDHW-FP16-F=ConvHipImplicitGemm3DGroupFwdXdlops:0.027984,92672,miopenConvolutionFwdAlgoImplicitGEMM;GemmFwd1x1_0_1:0.007608,0,miopenConvolutionFwdAlgoGEMM;ConvDirectNaiveConvFwd:0.0404514,0,miopenConvolutionFwdAlgoDirect
16-3-20-32-1x1x1-16-3-20-32-1-0x0x0-1x1x1-1x1x1-0-NCDHW-FP16-F=ConvHipImplicitGemm3DGroupFwdXdlops:0.0288857,123392,miopenConvolutionFwdAlgoImplicitGEMM;GemmFwd1x1_0_1:0.006184,0,miopenConvolutionFwdAlgoGEMM;ConvDirectNaiveConvFwd:0.0531373,0,miopenConvolutionFwdAlgoDirect
16-3-32-16-1x1x1-16-3-32-16-1-0x0x0-1x1x1-1x1x1-0-NCDHW-FP16-F=ConvHipImplicitGemm3DGroupFwdXdlops:0.02976,98816,miopenConvolutionFwdAlgoImplicitGEMM;GemmFwd1x1_0_1:0.006352,0,miopenConvolutionFwdAlgoGEMM;ConvDirectNaiveConvFwd:0.0405486,0,miopenConvolutionFwdAlgoDirect
16-3-32-24-1x1x1-16-3-32-24-1-0x0x0-1x1x1-1x1x1-0-NCDHW-FP16-F=ConvHipImplicitGemm3DGroupFwdXdlops:0.02874,147968,miopenConvolutionFwdAlgoImplicitGEMM;GemmFwd1x1_0_1:0.0060962,0,miopenConvolutionFwdAlgoGEMM;ConvDirectNaiveConvFwd:0.0594973,0,miopenConvolutionFwdAlgoDirect
16-3-32-32-1x1x1-16-3-32-32-1-0x0x0-1x1x1-1x1x1-0-NCDHW-FP16-F=ConvHipImplicitGemm3DGroupFwdXdlops:0.02898,197120,miopenConvolutionFwdAlgoImplicitGEMM;GemmFwd1x1_0_1:0.00606,0,miopenConvolutionFwdAlgoGEMM;ConvDirectNaiveConvFwd:0.0786,0,miopenConvolutionFwdAlgoDirect
16-4-18-26-3x3x3-512-2-16-24-1-0x0x0-1x1x1-1x1x1-0-NCDHW-FP16-F=ConvHipImplicitGemm3DGroupFwdXdlops:0.032424,1288704,miopenConvolutionFwdAlgoImplicitGEMM;GemmFwdRest:0.0231667,663552,miopenConvolutionFwdAlgoGEMM;ConvDirectNaiveConvFwd:0.232915,0,miopenConvolutionFwdAlgoDirect
16-4-18-34-3x3x3-512-2-16-32-1-0x0x0-1x1x1-1x1x1-0-NCDHW-FP16-F=ConvHipImplicitGemm3DGroupFwdXdlops:0.0332057,1569280,miopenConvolutionFwdAlgoImplicitGEMM;GemmFwdRest:0.01954,884736,miopenConvolutionFwdAlgoGEMM;ConvDirectNaiveConvFwd:0.311623,0,miopenConvolutionFwdAlgoDirect
16-4-20-18-3x3x3-512-2-18-16-1-0x0x0-1x1x1-1x1x1-0-NCDHW-FP16-F=ConvHipImplicitGemm3DGroupFwdXdlops:0.0407,1078272,miopenConvolutionFwdAlgoImplicitGEMM;GemmFwdRest:0.020312,497664,miopenConvolutionFwdAlgoGEMM;ConvDirectNaiveConvFwd:0.226592,0,miopenConvolutionFwdAlgoDirect
16-4-20-34-3x3x3-512-2-18-32-1-0x0x0-1x1x1-1x1x1-0-NCDHW-FP16-F=ConvHipImplicitGemm3DGroupFwdXdlops:0.0346082,1709056,miopenConvolutionFwdAlgoImplicitGEMM;GemmFwdRest:0.0269933,995328,miopenConvolutionFwdAlgoGEMM;ConvDirectNaiveConvFwd:0.388034,0,miopenConvolutionFwdAlgoDirect
16-4-22-26-3x3x3-512-2-20-24-1-0x0x0-1x1x1-1x1x1-0-NCDHW-FP16-F=ConvHipImplicitGemm3DGroupFwdXdlops:0.033216,1498624,miopenConvolutionFwdAlgoImplicitGEMM;GemmFwdRest:0.022584,829440,miopenConvolutionFwdAlgoGEMM;ConvDirectNaiveConvFwd:0.30908,0,miopenConvolutionFwdAlgoDirect
16-4-22-34-3x3x3-512-2-20-32-1-0x0x0-1x1x1-1x1x1-0-NCDHW-FP16-F=ConvHipImplicitGemm3DGroupFwdXdlops:0.0358202,1848832,miopenConvolutionFwdAlgoImplicitGEMM;GemmFwdRest:0.0340267,1105920,miopenConvolutionFwdAlgoGEMM;ConvDirectNaiveConvFwd:0.388755,0,miopenConvolutionFwdAlgoDirect
16-4-34-18-3x3x3-512-2-32-16-1-0x0x0-1x1x1-1x1x1-0-NCDHW-FP16-F=ConvHipImplicitGemm3DGroupFwdXdlops:0.0329735,1569280,miopenConvolutionFwdAlgoImplicitGEMM;GemmFwdRest:0.020888,884736,miopenConvolutionFwdAlgoGEMM;ConvDirectNaiveConvFwd:0.309292,0,miopenConvolutionFwdAlgoDirect
16-4-34-26-3x3x3-512-2-32-24-1-0x0x0-1x1x1-1x1x1-0-NCDHW-FP16-F=ConvHipImplicitGemm3DGroupFwdXdlops:0.034128,2128384,miopenConvolutionFwdAlgoImplicitGEMM;GemmFwdRest:0.0385135,1327104,miopenConvolutionFwdAlgoGEMM;ConvDirectNaiveConvFwd:0.463608,0,miopenConvolutionFwdAlgoDirect
16-4-34-34-3x3x3-512-2-32-32-1-0x0x0-1x1x1-1x1x1-0-NCDHW-FP16-F=ConvHipImplicitGemm3DGroupFwdXdlops:0.0392267,2687488,miopenConvolutionFwdAlgoImplicitGEMM;GemmFwdRest:0.02972,1769472,miopenConvolutionFwdAlgoGEMM;ConvDirectNaiveConvFwd:0.620468,0,miopenConvolutionFwdAlgoDirect
16-5-16-24-1x1x1-16-5-16-24-1-0x0x0-1x1x1-1x1x1-0-NCDHW-FP16-F=ConvHipImplicitGemm3DGroupFwdXdlops:0.0284735,123392,miopenConvolutionFwdAlgoImplicitGEMM;GemmFwd1x1_0_1:0.006208,0,miopenConvolutionFwdAlgoGEMM;ConvDirectNaiveConvFwd:0.053103,0,miopenConvolutionFwdAlgoDirect
16-5-16-32-1x1x1-16-5-16-32-1-0x0x0-1x1x1-1x1x1-0-NCDHW-FP16-F=ConvHipImplicitGemm3DGroupFwdXdlops:0.0288571,164352,miopenConvolutionFwdAlgoImplicitGEMM;GemmFwd1x1_0_1:0.006264,0,miopenConvolutionFwdAlgoGEMM;ConvDirectNaiveConvFwd:0.0658687,0,miopenConvolutionFwdAlgoDirect
16-5-18-16-1x1x1-16-5-18-16-1-0x0x0-1x1x1-1x1x1-0-NCDHW-FP16-F=ConvHipImplicitGemm3DGroupFwdXdlops:0.0277867,92672,miopenConvolutionFwdAlgoImplicitGEMM;GemmFwd1x1_0_1:0.00773333,0,miopenConvolutionFwdAlgoGEMM;ConvDirectNaiveConvFwd:0.0403829,0,miopenConvolutionFwdAlgoDirect
16-5-18-26-3x3x3-512-3-16-24-1-0x0x0-1x1x1-1x1x1-0-NCDHW-FP16-F=ConvHipImplicitGemm3DGroupFwdXdlops:0.0334735,1697024,miopenConvolutionFwdAlgoImplicitGEMM;GemmFwdRest:0.0270467,995328,miopenConvolutionFwdAlgoGEMM;ConvDirectNaiveConvFwd:0.385074,0,miopenConvolutionFwdAlgoDirect
16-5-18-32-1x1x1-16-5-18-32-1-0x0x0-1x1x1-1x1x1-0-NCDHW-FP16-F=ConvHipImplicitGemm3DGroupFwdXdlops:0.0289,184832,miopenConvolutionFwdAlgoImplicitGEMM;GemmFwd1x1_0_1:0.006,0,miopenConvolutionFwdAlgoGEMM;ConvDirectNaiveConvFwd:0.0786562,0,miopenConvolutionFwdAlgoDirect
16-5-18-34-3x3x3-512-3-16-32-1-0x0x0-1x1x1-1x1x1-0-NCDHW-FP16-F=ConvHipImplicitGemm3DGroupFwdXdlops:0.0348459,2113280,miopenConvolutionFwdAlgoImplicitGEMM;GemmFwdRest:0.04004,1327104,miopenConvolutionFwdAlgoGEMM;ConvDirectNaiveConvFwd:0.465807,0,miopenConvolutionFwdAlgoDirect
16-5-20-18-3x3x3-512-3-18-16-1-0x0x0-1x1x1-1x1x1-0-NCDHW-FP16-F=ConvHipImplicitGemm3DGroupFwdXdlops:0.0322935,1384704,miopenConvolutionFwdAlgoImplicitGEMM;GemmFwdRest:0.0243267,746496,miopenConvolutionFwdAlgoGEMM;ConvDirectNaiveConvFwd:0.307001,0,miopenConvolutionFwdAlgoDirect
16-5-20-24-1x1x1-16-5-20-24-1-0x0x0-1x1x1-1x1x1-0-NCDHW-FP16-F=ConvHipImplicitGemm3DGroupFwdXdlops:0.0303086,154112,miopenConvolutionFwdAlgoImplicitGEMM;GemmFwd1x1_0_1:0.00786667,0,miopenConvolutionFwdAlgoGEMM;ConvDirectNaiveConvFwd:0.0659735,0,miopenConvolutionFwdAlgoDirect
16-5-20-32-1x1x1-16-5-20-32-1-0x0x0-1x1x1-1x1x1-0-NCDHW-FP16-F=ConvHipImplicitGemm3DGroupFwdXdlops:0.028128,205312,miopenConvolutionFwdAlgoImplicitGEMM;GemmFwd1x1_0_1:0.008272,0,miopenConvolutionFwdAlgoGEMM;ConvDirectNaiveConvFwd:0.0850459,0,miopenConvolutionFwdAlgoDirect
16-5-20-34-3x3x3-512-3-18-32-1-0x0x0-1x1x1-1x1x1-0-NCDHW-FP16-F=ConvHipImplicitGemm3DGroupFwdXdlops:0.035567,2320640,miopenConvolutionFwdAlgoImplicitGEMM;GemmFwdRest:0.039464,1492992,miopenConvolutionFwdAlgoGEMM;ConvDirectNaiveConvFwd:0.541452,0,miopenConvolutionFwdAlgoDirect
16-5-22-26-3x3x3-512-3-20-24-1-0x0x0-1x1x1-1x1x1-0-NCDHW-FP16-F=ConvHipImplicitGemm3DGroupFwdXdlops:0.0338468,2008576,miopenConvolutionFwdAlgoImplicitGEMM;GemmFwdRest:0.037064,1244160,miopenConvolutionFwdAlgoGEMM;ConvDirectNaiveConvFwd:0.462641,0,miopenConvolutionFwdAlgoDirect
16-5-22-34-3x3x3-512-3-20-32-1-0x0x0-1x1x1-1x1x1-0-NCDHW-FP16-F=ConvHipImplicitGemm3DGroupFwdXdlops:0.0386401,2528256,miopenConvolutionFwdAlgoImplicitGEMM;GemmFwdRest:0.03002,1658880,miopenConvolutionFwdAlgoGEMM;ConvDirectNaiveConvFwd:0.619561,0,miopenConvolutionFwdAlgoDirect
16-5-32-16-1x1x1-16-5-32-16-1-0x0x0-1x1x1-1x1x1-0-NCDHW-FP16-F=ConvHipImplicitGemm3DGroupFwdXdlops:0.02908,164352,miopenConvolutionFwdAlgoImplicitGEMM;GemmFwd1x1_0_1:0.00599,0,miopenConvolutionFwdAlgoGEMM;ConvDirectNaiveConvFwd:0.0659257,0,miopenConvolutionFwdAlgoDirect
16-5-32-24-1x1x1-16-5-32-24-1-0x0x0-1x1x1-1x1x1-0-NCDHW-FP16-F=ConvHipImplicitGemm3DGroupFwdXdlops:0.0288802,246272,miopenConvolutionFwdAlgoImplicitGEMM;GemmFwd1x1_0_1:0.0114533,0,miopenConvolutionFwdAlgoGEMM;ConvDirectNaiveConvFwd:0.0981402,0,miopenConvolutionFwdAlgoDirect
16-5-32-32-1x1x1-16-5-32-32-1-0x0x0-1x1x1-1x1x1-0-NCDHW-FP16-F=ConvHipImplicitGemm3DGroupFwdXdlops:0.0278,328192,miopenConvolutionFwdAlgoImplicitGEMM;GemmFwd1x1_0_1:0.00786667,0,miopenConvolutionFwdAlgoGEMM;ConvDirectNaiveConvFwd:0.12956,0,miopenConvolutionFwdAlgoDirect
16-5-34-18-3x3x3-512-3-32-16-1-0x0x0-1x1x1-1x1x1-0-NCDHW-FP16-F=ConvHipImplicitGemm3DGroupFwdXdlops:0.0347002,2113280,miopenConvolutionFwdAlgoImplicitGEMM;GemmFwdRest:0.03658,1327104,miopenConvolutionFwdAlgoGEMM;ConvDirectNaiveConvFwd:0.461593,0,miopenConvolutionFwdAlgoDirect
16-5-34-26-3x3x3-512-3-32-24-1-0x0x0-1x1x1-1x1x1-0-NCDHW-FP16-F=ConvHipImplicitGemm3DGroupFwdXdlops:0.0416629,2943232,miopenConvolutionFwdAlgoImplicitGEMM;GemmFwdRest:0.0285933,1990656,miopenConvolutionFwdAlgoGEMM;ConvDirectNaiveConvFwd:0.694288,0,miopenConvolutionFwdAlgoDirect
16-5-34-34-3x3x3-512-3-32-32-1-0x0x0-1x1x1-1x1x1-0-NCDHW-FP16-F=ConvHipImplicitGemm3DGroupFwdXdlops:0.0438002,3773184,miopenConvolutionFwdAlgoImplicitGEMM;GemmFwdRest:0.0349068,2654208,miopenConvolutionFwdAlgoGEMM;ConvDirectNaiveConvFwd:0.929339,0,miopenConvolutionFwdAlgoDirect
16-7-18-26-3x3x3-512-5-16-24-1-0x0x0-1x1x1-1x1x1-0-NCDHW-FP16-F=ConvHipImplicitGemm3DGroupFwdXdlops:0.0392857,2513408,miopenConvolutionFwdAlgoImplicitGEMM;GemmFwdRest:0.03281,1658880,miopenConvolutionFwdAlgoGEMM;ConvDirectNaiveConvFwd:0.615531,0,miopenConvolutionFwdAlgoDirect
16-7-18-34-3x3x3-512-5-16-32-1-0x0x0-1x1x1-1x1x1-0-NCDHW-FP16-F=ConvHipImplicitGemm3DGroupFwdXdlops:0.0428173,3201024,miopenConvolutionFwdAlgoImplicitGEMM;GemmFwdRest:0.0329602,2211840,miopenConvolutionFwdAlgoGEMM;ConvDirectNaiveConvFwd:0.775624,0,miopenConvolutionFwdAlgoDirect
16-7-20-18-3x3x3-512-5-18-16-1-0x0x0-1x1x1-1x1x1-0-NCDHW-FP16-F=ConvHipImplicitGemm3DGroupFwdXdlops:0.0336722,1997568,miopenConvolutionFwdAlgoImplicitGEMM;GemmFwdRest:0.0376962,1244160,miopenConvolutionFwdAlgoGEMM;ConvDirectNaiveConvFwd:0.460161,0,miopenConvolutionFwdAlgoDirect
16-7-20-34-3x3x3-512-5-18-32-1-0x0x0-1x1x1-1x1x1-0-NCDHW-FP16-F=ConvHipImplicitGemm3DGroupFwdXdlops:0.0443143,3543808,miopenConvolutionFwdAlgoImplicitGEMM;GemmFwdRest:0.05056,2488320,miopenConvolutionFwdAlgoGEMM;ConvDirectNaiveConvFwd:0.925413,0,miopenConvolutionFwdAlgoDirect
16-7-22-26-3x3x3-512-5-20-24-1-0x0x0-1x1x1-1x1x1-0-NCDHW-FP16-F=ConvHipImplicitGemm3DGroupFwdXdlops:0.0436202,3028224,miopenConvolutionFwdAlgoImplicitGEMM;GemmFwdRest:0.0451668,2073600,miopenConvolutionFwdAlgoGEMM;ConvDirectNaiveConvFwd:0.769034,0,miopenConvolutionFwdAlgoDirect
16-7-22-34-3x3x3-512-5-20-32-1-0x0x0-1x1x1-1x1x1-0-NCDHW-FP16-F=ConvHipImplicitGemm3DGroupFwdXdlops:0.046176,3886848,miopenConvolutionFwdAlgoImplicitGEMM;GemmFwdRest:0.0421,2764800,miopenConvolutionFwdAlgoGEMM;ConvDirectNaiveConvFwd:1.00439,0,miopenConvolutionFwdAlgoDirect
16-7-34-18-3x3x3-512-5-32-16-1-0x0x0-1x1x1-1x1x1-0-NCDHW-FP16-F=ConvHipImplicitGemm3DGroupFwdXdlops:0.042648,3201024,miopenConvolutionFwdAlgoImplicitGEMM;GemmFwdRest:0.032832,2211840,miopenConvolutionFwdAlgoGEMM;ConvDirectNaiveConvFwd:0.766516,0,miopenConvolutionFwdAlgoDirect
16-7-34-26-3x3x3-512-5-32-24-1-0x0x0-1x1x1-1x1x1-0-NCDHW-FP16-F=ConvHipImplicitGemm3DGroupFwdXdlops:0.0492514,4572672,miopenConvolutionFwdAlgoImplicitGEMM;GemmFwdRest:0.0410733,3317760,miopenConvolutionFwdAlgoGEMM;ConvDirectNaiveConvFwd:1.15429,0,miopenConvolutionFwdAlgoDirect
16-7-34-34-3x3x3-512-5-32-32-1-0x0x0-1x1x1-1x1x1-0-NCDHW-FP16-F=ConvHipImplicitGemm3DGroupFwdXdlops:0.0463267,5944320,miopenConvolutionFwdAlgoImplicitGEMM;GemmFwdRest:0.0490802,4423680,miopenConvolutionFwdAlgoGEMM;ConvDirectNaiveConvFwd:1.54505,0,miopenConvolutionFwdAlgoDirect
256-11-130-130-3x3x3-256-9-128-128-1-0x0x0-1x1x1-1x1x1-0-NCDHW-FP16-F=ConvHipImplicitGemm3DGroupFwdXdlops:1.21711,174217216,miopenConvolutionFwdAlgoImplicitGEMM;GemmFwdRest:5.04643,2038431744,miopenConvolutionFwdAlgoGEMM;ConvDirectNaiveConvFwd:794.165,0,miopenConvolutionFwdAlgoDirect
256-11-130-194-3x3x3-128-9-128-192-1-0x0x0-1x1x1-1x1x1-0-NCDHW-FP16-F=ConvHipImplicitGemm3DGroupFwdXdlops:1.06775,200431616,miopenConvolutionFwdAlgoImplicitGEMM;GemmFwdRest:7.33361,3057647616,miopenConvolutionFwdAlgoGEMM;ConvDirectNaiveConvFwd:1199.36,0,miopenConvolutionFwdAlgoDirect
256-11-130-194-3x3x3-256-9-128-192-1-0x0x0-1x1x1-1x1x1-0-NCDHW-FP16-F=ConvHipImplicitGemm3DGroupFwdXdlops:1.91433,258824192,miopenConvolutionFwdAlgoImplicitGEMM;GemmFwdRest:8.63692,3057647616,miopenConvolutionFwdAlgoGEMM;ConvDirectNaiveConvFwd:1170.83,0,miopenConvolutionFwdAlgoDirect
256-11-130-258-3x3x3-128-9-128-256-1-0x0x0-1x1x1-1x1x1-0-NCDHW-FP16-F=ConvHipImplicitGemm3DGroupFwdXdlops:1.48961,266164224,miopenConvolutionFwdAlgoImplicitGEMM;GemmFwdRest:10.0559,4076863488,miopenConvolutionFwdAlgoGEMM;ConvDirectNaiveConvFwd:1528.94,0,miopenConvolutionFwdAlgoDirect
256-11-130-258-3x3x3-256-9-128-256-1-0x0x0-1x1x1-1x1x1-0-NCDHW-FP16-F=ConvHipImplicitGemm3DGroupFwdXdlops:2.54381,343431168,miopenConvolutionFwdAlgoImplicitGEMM;GemmFwdRest:10.5644,4076863488,miopenConvolutionFwdAlgoGEMM;ConvDirectNaiveConvFwd:1536.26,0,miopenConvolutionFwdAlgoDirect
256-11-130-66-3x3x3-256-9-128-64-1-0x0x0-1x1x1-1x1x1-0-NCDHW-FP16-F=ConvHipImplicitGemm3DGroupFwdXdlops:0.584314,89610240,miopenConvolutionFwdAlgoImplicitGEMM;GemmFwdRest:2.73448,1019215872,miopenConvolutionFwdAlgoGEMM;ConvDirectNaiveConvFwd:422.622,0,miopenConvolutionFwdAlgoDirect
256-11-130-98-3x3x3-256-9-128-96-1-0x0x0-1x1x1-1x1x1-0-NCDHW-FP16-F=ConvHipImplicitGemm3DGroupFwdXdlops:0.878314,131913728,miopenConvolutionFwdAlgoImplicitGEMM;GemmFwdRest:3.74465,1528823808,miopenConvolutionFwdAlgoGEMM;ConvDirectNaiveConvFwd:617.076,0,miopenConvolutionFwdAlgoDirect
256-11-146-130-3x3x3-128-9-144-128-1-0x0x0-1x1x1-1x1x1-0-NCDHW-FP16-F=ConvHipImplicitGemm3DGroupFwdXdlops:0.852902,151132160,miopenConvolutionFwdAlgoImplicitGEMM;GemmFwdRest:5.56373,2293235712,miopenConvolutionFwdAlgoGEMM;ConvDirectNaiveConvFwd:914.78,0,miopenConvolutionFwdAlgoDirect
256-11-146-130-3x3x3-256-9-144-128-1-0x0x0-1x1x1-1x1x1-0-NCDHW-FP16-F=ConvHipImplicitGemm3DGroupFwdXdlops:1.45091,195368960,miopenConvolutionFwdAlgoImplicitGEMM;GemmFwdRest:5.82261,2293235712,miopenConvolutionFwdAlgoGEMM;ConvDirectNaiveConvFwd:904.663,0,miopenConvolutionFwdAlgoDirect
256-11-146-258-3x3x3-128-9-144-256-1-0x0x0-1x1x1-1x1x1-0-NCDHW-FP16-F=ConvHipImplicitGemm3DGroupFwdXdlops:1.67057,298850304,miopenConvolutionFwdAlgoImplicitGEMM;GemmFwdRest:11.332,4586471424,miopenConvolutionFwdAlgoGEMM;ConvDirectNaiveConvFwd:1725.48,0,miopenConvolutionFwdAlgoDirect
256-11-146-258-3x3x3-256-9-144-256-1-0x0x0-1x1x1-1x1x1-0-NCDHW-FP16-F=ConvHipImplicitGemm3DGroupFwdXdlops:2.90792,385554432,miopenConvolutionFwdAlgoImplicitGEMM;GemmFwdRest:11.9956,4586471424,miopenConvolutionFwdAlgoGEMM;ConvDirectNaiveConvFwd:1746.95,0,miopenConvolutionFwdAlgoDirect
256-11-162-194-3x3x3-128-9-160-192-1-0x0x0-1x1x1-1x1x1-0-NCDHW-FP16-F=ConvHipImplicitGemm3DGroupFwdXdlops:1.40543,249550848,miopenConvolutionFwdAlgoImplicitGEMM;GemmFwdRest:9.50187,3822059520,miopenConvolutionFwdAlgoGEMM;ConvDirectNaiveConvFwd:1499.9,0,miopenConvolutionFwdAlgoDirect
256-11-162-194-3x3x3-256-9-160-192-1-0x0x0-1x1x1-1x1x1-0-NCDHW-FP16-F=ConvHipImplicitGemm3DGroupFwdXdlops:2.48868,322099200,miopenConvolutionFwdAlgoImplicitGEMM;GemmFwdRest:9.86031,3822059520,miopenConvolutionFwdAlgoGEMM;ConvDirectNaiveConvFwd:1476.06,0,miopenConvolutionFwdAlgoDirect
256-11-162-258-3x3x3-128-9-160-256-1-0x0x0-1x1x1-1x1x1-0-NCDHW-FP16-F=ConvHipImplicitGemm3DGroupFwdXdlops:1.85423,331536384,miopenConvolutionFwdAlgoImplicitGEMM;GemmFwdRest:12.6107,5096079360,miopenConvolutionFwdAlgoGEMM;ConvDirectNaiveConvFwd:1920.57,0,miopenConvolutionFwdAlgoDirect
256-11-162-258-3x3x3-256-9-160-256-1-0x0x0-1x1x1-1x1x1-0-NCDHW-FP16-F=ConvHipImplicitGemm3DGroupFwdXdlops:3.2416,427677696,miopenConvolutionFwdAlgoImplicitGEMM;GemmFwdRest:13.1206,5096079360,miopenConvolutionFwdAlgoGEMM;ConvDirectNaiveConvFwd:1937.65,0,miopenConvolutionFwdAlgoDirect
256-11-258-130-3x3x3-128-9-256-128-1-0x0x0-1x1x1-1x1x1-0-NCDHW-FP16-F=ConvHipImplicitGemm3DGroupFwdXdlops:1.47154,266164224,miopenConvolutionFwdAlgoImplicitGEMM;GemmFwdRest:10.0743,4076863488,miopenConvolutionFwdAlgoGEMM;ConvDirectNaiveConvFwd:1607.59,0,miopenConvolutionFwdAlgoDirect
256-11-258-130-3x3x3-256-9-256-128-1-0x0x0-1x1x1-1x1x1-0-NCDHW-FP16-F=ConvHipImplicitGemm3DGroupFwdXdlops:2.59372,343431168,miopenConvolutionFwdAlgoImplicitGEMM;GemmFwdRest:10.6522,4076863488,miopenConvolutionFwdAlgoGEMM;ConvDirectNaiveConvFwd:1585.97,0,miopenConvolutionFwdAlgoDirect
256-11-258-194-3x3x3-128-9-256-192-1-0x0x0-1x1x1-1x1x1-0-NCDHW-FP16-F=ConvHipImplicitGemm3DGroupFwdXdlops:2.26703,396908544,miopenConvolutionFwdAlgoImplicitGEMM;GemmFwdRest:15.1238,6115295232,miopenConvolutionFwdAlgoGEMM;ConvDirectNaiveConvFwd:2433.74,0,miopenConvolutionFwdAlgoDirect
256-11-258-194-3x3x3-256-9-256-192-1-0x0x0-1x1x1-1x1x1-0-NCDHW-FP16-F=ConvHipImplicitGemm3DGroupFwdXdlops:3.85384,511924224,miopenConvolutionFwdAlgoImplicitGEMM;GemmFwdRest:15.7479,6115295232,miopenConvolutionFwdAlgoGEMM;ConvDirectNaiveConvFwd:2386.41,0,miopenConvolutionFwdAlgoDirect
256-11-258-258-3x3x3-128-9-256-256-1-0x0x0-1x1x1-1x1x1-0-NCDHW-FP16-F=ConvHipImplicitGemm3DGroupFwdXdlops:3.15549,527652864,miopenConvolutionFwdAlgoImplicitGEMM;ConvDirectNaiveConvFwd:3089.04,0,miopenConvolutionFwdAlgoDirect
256-11-258-258-3x3x3-256-9-256-256-1-0x0x0-1x1x1-1x1x1-0-NCDHW-FP16-F=ConvHipImplicitGemm3DGroupFwdXdlops:5.27535,680417280,miopenConvolutionFwdAlgoImplicitGEMM;ConvDirectNaiveConvFwd:3098.13,0,miopenConvolutionFwdAlgoDirect
256-11-66-130-3x3x3-256-9-64-128-1-0x0x0-1x1x1-1x1x1-0-NCDHW-FP16-F=ConvHipImplicitGemm3DGroupFwdXdlops:0.592521,89610240,miopenConvolutionFwdAlgoImplicitGEMM;GemmFwdRest:2.77674,1019215872,miopenConvolutionFwdAlgoGEMM;ConvDirectNaiveConvFwd:395.954,0,miopenConvolutionFwdAlgoDirect
256-11-66-98-3x3x3-256-9-64-96-1-0x0x0-1x1x1-1x1x1-0-NCDHW-FP16-F=ConvHipImplicitGemm3DGroupFwdXdlops:0.479881,68278272,miopenConvolutionFwdAlgoImplicitGEMM;GemmFwdRest:2.05238,764411904,miopenConvolutionFwdAlgoGEMM;ConvDirectNaiveConvFwd:308.71,0,miopenConvolutionFwdAlgoDirect
256-11-74-130-3x3x3-256-9-72-128-1-0x0x0-1x1x1-1x1x1-0-NCDHW-FP16-F=ConvHipImplicitGemm3DGroupFwdXdlops:0.83939,100186112,miopenConvolutionFwdAlgoImplicitGEMM;GemmFwdRest:3.23025,1146617856,miopenConvolutionFwdAlgoGEMM;ConvDirectNaiveConvFwd:456.849,0,miopenConvolutionFwdAlgoDirect
256-11-74-66-3x3x3-256-9-72-64-1-0x0x0-1x1x1-1x1x1-0-NCDHW-FP16-F=ConvHipImplicitGemm3DGroupFwdXdlops:0.404207,52279296,miopenConvolutionFwdAlgoImplicitGEMM;GemmFwdRest:1.65796,573308928,miopenConvolutionFwdAlgoGEMM;ConvDirectNaiveConvFwd:237.766,0,miopenConvolutionFwdAlgoDirect
256-11-82-130-3x3x3-256-9-80-128-1-0x0x0-1x1x1-1x1x1-0-NCDHW-FP16-F=ConvHipImplicitGemm3DGroupFwdXdlops:0.766796,110761984,miopenConvolutionFwdAlgoImplicitGEMM;GemmFwdRest:3.58062,1274019840,miopenConvolutionFwdAlgoGEMM;ConvDirectNaiveConvFwd:499.278,0,miopenConvolutionFwdAlgoDirect
256-11-82-98-3x3x3-256-9-80-96-1-0x0x0-1x1x1-1x1x1-0-NCDHW-FP16-F=ConvHipImplicitGemm3DGroupFwdXdlops:0.539501,84187136,miopenConvolutionFwdAlgoImplicitGEMM;GemmFwdRest:2.63822,955514880,miopenConvolutionFwdAlgoGEMM;ConvDirectNaiveConvFwd:389.516,0,miopenConvolutionFwdAlgoDirect
256-17-128-192-1x1x1-128-17-128-192-1-0x0x0-1x1x1-1x1x1-0-NCDHW-FP16-F=ConvHipImplicitGemm3DGroupFwdXdlops:0.535281,320929792,miopenConvolutionFwdAlgoImplicitGEMM;GemmFwd1x1_0_1:0.234647,0,miopenConvolutionFwdAlgoGEMM;ConvDirectNaiveConvFwd:245.78,0,miopenConvolutionFwdAlgoDirect
256-17-128-256-1x1x1-128-17-128-256-1-0x0x0-1x1x1-1x1x1-0-NCDHW-FP16-F=ConvHipImplicitGemm3DGroupFwdXdlops:0.760276,427884544,miopenConvolutionFwdAlgoImplicitGEMM;GemmFwd1x1_0_1:0.330187,0,miopenConvolutionFwdAlgoGEMM;ConvDirectNaiveConvFwd:343.351,0,miopenConvolutionFwdAlgoDirect
256-17-144-128-1x1x1-128-17-144-128-1-0x0x0-1x1x1-1x1x1-0-NCDHW-FP16-F=ConvHipImplicitGemm3DGroupFwdXdlops:0.414689,240713728,miopenConvolutionFwdAlgoImplicitGEMM;GemmFwd1x1_0_1:0.174392,0,miopenConvolutionFwdAlgoGEMM;ConvDirectNaiveConvFwd:156.525,0,miopenConvolutionFwdAlgoDirect
256-17-144-256-1x1x1-128-17-144-256-1-0x0x0-1x1x1-1x1x1-0-NCDHW-FP16-F=ConvHipImplicitGemm3DGroupFwdXdlops:0.924973,481361920,miopenConvolutionFwdAlgoImplicitGEMM;GemmFwd1x1_0_1:0.375201,0,miopenConvolutionFwdAlgoGEMM;ConvDirectNaiveConvFwd:385.721,0,miopenConvolutionFwdAlgoDirect
256-17-160-192-1x1x1-128-17-160-192-1-0x0x0-1x1x1-1x1x1-0-NCDHW-FP16-F=ConvHipImplicitGemm3DGroupFwdXdlops:0.713481,401145856,miopenConvolutionFwdAlgoImplicitGEMM;GemmFwd1x1_0_1:0.306594,0,miopenConvolutionFwdAlgoGEMM;ConvDirectNaiveConvFwd:309.762,0,miopenConvolutionFwdAlgoDirect
256-17-160-256-1x1x1-128-17-160-256-1-0x0x0-1x1x1-1x1x1-0-NCDHW-FP16-F=ConvHipImplicitGemm3DGroupFwdXdlops:0.921312,534839296,miopenConvolutionFwdAlgoImplicitGEMM;GemmFwd1x1_0_1:0.408744,0,miopenConvolutionFwdAlgoGEMM;ConvDirectNaiveConvFwd:425.006,0,miopenConvolutionFwdAlgoDirect
256-17-256-128-1x1x1-128-17-256-128-1-0x0x0-1x1x1-1x1x1-0-NCDHW-FP16-F=ConvHipImplicitGemm3DGroupFwdXdlops:0.735802,427884544,miopenConvolutionFwdAlgoImplicitGEMM;GemmFwd1x1_0_1:0.323351,0,miopenConvolutionFwdAlgoGEMM;ConvDirectNaiveConvFwd:343.082,0,miopenConvolutionFwdAlgoDirect
256-17-256-192-1x1x1-128-17-256-192-1-0x0x0-1x1x1-1x1x1-0-NCDHW-FP16-F=ConvHipImplicitGemm3DGroupFwdXdlops:1.10283,641794048,miopenConvolutionFwdAlgoImplicitGEMM;GemmFwd1x1_0_1:0.494047,0,miopenConvolutionFwdAlgoGEMM;ConvDirectNaiveConvFwd:519.814,0,miopenConvolutionFwdAlgoDirect
256-17-256-256-1x1x1-128-17-256-256-1-0x0x0-1x1x1-1x1x1-0-NCDHW-FP16-F=ConvHipImplicitGemm3DGroupFwdXdlops:1.5519,855703552,miopenConvolutionFwdAlgoImplicitGEMM;GemmFwd1x1_0_1:0.692431,0,miopenConvolutionFwdAlgoGEMM;ConvDirectNaiveConvFwd:710.911,0,miopenConvolutionFwdAlgoDirect
256-19-130-194-3x3x3-128-17-128-192-1-0x0x0-1x1x1-1x1x1-0-NCDHW-FP16-F=ConvHipImplicitGemm3DGroupFwdXdlops:2.09964,354064384,miopenConvolutionFwdAlgoImplicitGEMM;GemmFwdRest:14.3834,5775556608,miopenConvolutionFwdAlgoGEMM;ConvDirectNaiveConvFwd:2286.52,0,miopenConvolutionFwdAlgoDirect
256-19-130-194-3x3x3-256-17-128-192-1-0x0x0-1x1x1-1x1x1-0-NCDHW-FP16-F=ConvHipImplicitGemm3DGroupFwdXdlops:3.67755,462788608,miopenConvolutionFwdAlgoImplicitGEMM;GemmFwdRest:14.9132,5775556608,miopenConvolutionFwdAlgoGEMM;ConvDirectNaiveConvFwd:2284.4,0,miopenConvolutionFwdAlgoDirect
256-19-130-258-3x3x3-128-17-128-256-1-0x0x0-1x1x1-1x1x1-0-NCDHW-FP16-F=ConvHipImplicitGemm3DGroupFwdXdlops:2.91517,470652928,miopenConvolutionFwdAlgoImplicitGEMM;ConvDirectNaiveConvFwd:2920,0,miopenConvolutionFwdAlgoDirect
256-19-130-258-3x3x3-256-17-128-256-1-0x0x0-1x1x1-1x1x1-0-NCDHW-FP16-F=ConvHipImplicitGemm3DGroupFwdXdlops:4.99281,615028736,miopenConvolutionFwdAlgoImplicitGEMM;ConvDirectNaiveConvFwd:2930.04,0,miopenConvolutionFwdAlgoDirect
256-19-146-130-3x3x3-128-17-144-128-1-0x0x0-1x1x1-1x1x1-0-NCDHW-FP16-F=ConvHipImplicitGemm3DGroupFwdXdlops:1.53827,266622976,miopenConvolutionFwdAlgoImplicitGEMM;GemmFwdRest:10.8044,4331667456,miopenConvolutionFwdAlgoGEMM;ConvDirectNaiveConvFwd:1706.68,0,miopenConvolutionFwdAlgoDirect
256-19-146-130-3x3x3-256-17-144-128-1-0x0x0-1x1x1-1x1x1-0-NCDHW-FP16-F=ConvHipImplicitGemm3DGroupFwdXdlops:2.76992,348608512,miopenConvolutionFwdAlgoImplicitGEMM;GemmFwdRest:11.4927,4331667456,miopenConvolutionFwdAlgoGEMM;ConvDirectNaiveConvFwd:1696.51,0,miopenConvolutionFwdAlgoDirect
256-19-146-258-3x3x3-128-17-144-256-1-0x0x0-1x1x1-1x1x1-0-NCDHW-FP16-F=ConvHipImplicitGemm3DGroupFwdXdlops:3.29231,528635904,miopenConvolutionFwdAlgoImplicitGEMM;ConvDirectNaiveConvFwd:3301.42,0,miopenConvolutionFwdAlgoDirect
256-19-146-258-3x3x3-256-17-144-256-1-0x0x0-1x1x1-1x1x1-0-NCDHW-FP16-F=ConvHipImplicitGemm3DGroupFwdXdlops:5.68036,690837504,miopenConvolutionFwdAlgoImplicitGEMM;ConvDirectNaiveConvFwd:3312.32,0,miopenConvolutionFwdAlgoDirect
256-19-162-194-3x3x3-128-17-160-192-1-0x0x0-1x1x1-1x1x1-0-NCDHW-FP16-F=ConvHipImplicitGemm3DGroupFwdXdlops:2.63998,441194496,miopenConvolutionFwdAlgoImplicitGEMM;GemmFwdRest:17.9487,7219445760,miopenConvolutionFwdAlgoGEMM;ConvDirectNaiveConvFwd:2859.81,0,miopenConvolutionFwdAlgoDirect
256-19-162-194-3x3x3-256-17-160-192-1-0x0x0-1x1x1-1x1x1-0-NCDHW-FP16-F=ConvHipImplicitGemm3DGroupFwdXdlops:4.59066,576657408,miopenConvolutionFwdAlgoImplicitGEMM;GemmFwdRest:18.6361,7219445760,miopenConvolutionFwdAlgoGEMM;ConvDirectNaiveConvFwd:2855.79,0,miopenConvolutionFwdAlgoDirect
256-19-162-258-3x3x3-128-17-160-256-1-0x0x0-1x1x1-1x1x1-0-NCDHW-FP16-F=ConvHipImplicitGemm3DGroupFwdXdlops:3.68922,586618880,miopenConvolutionFwdAlgoImplicitGEMM;ConvDirectNaiveConvFwd:3665.51,0,miopenConvolutionFwdAlgoDirect
256-19-162-258-3x3x3-256-17-160-256-1-0x0x0-1x1x1-1x1x1-0-NCDHW-FP16-F=ConvHipImplicitGemm3DGroupFwdXdlops:6.17749,766646272,miopenConvolutionFwdAlgoImplicitGEMM;ConvDirectNaiveConvFwd:3679.71,0,miopenConvolutionFwdAlgoDirect
256-19-258-130-3x3x3-128-17-256-128-1-0x0x0-1x1x1-1x1x1-0-NCDHW-FP16-F=ConvHipImplicitGemm3DGroupFwdXdlops:2.88996,470652928,miopenConvolutionFwdAlgoImplicitGEMM;ConvDirectNaiveConvFwd:3028.19,0,miopenConvolutionFwdAlgoDirect
256-19-258-130-3x3x3-256-17-256-128-1-0x0x0-1x1x1-1x1x1-0-NCDHW-FP16-F=ConvHipImplicitGemm3DGroupFwdXdlops:4.96059,615028736,miopenConvolutionFwdAlgoImplicitGEMM;ConvDirectNaiveConvFwd:3040.8,0,miopenConvolutionFwdAlgoDirect
256-19-258-194-3x3x3-128-17-256-192-1-0x0x0-1x1x1-1x1x1-0-NCDHW-FP16-F=ConvHipImplicitGemm3DGroupFwdXdlops:4.35669,702584832,miopenConvolutionFwdAlgoImplicitGEMM;ConvDirectNaiveConvFwd:4596.88,0,miopenConvolutionFwdAlgoDirect
256-19-258-194-3x3x3-256-17-256-192-1-0x0x0-1x1x1-1x1x1-0-NCDHW-FP16-F=ConvHipImplicitGemm3DGroupFwdXdlops:7.47111,918263808,miopenConvolutionFwdAlgoImplicitGEMM;ConvDirectNaiveConvFwd:4581.17,0,miopenConvolutionFwdAlgoDirect
256-19-258-258-3x3x3-128-17-256-256-1-0x0x0-1x1x1-1x1x1-0-NCDHW-FP16-F=ConvHipImplicitGemm3DGroupFwdXdlops:5.88636,934516736,miopenConvolutionFwdAlgoImplicitGEMM;ConvDirectNaiveConvFwd:5850.34,0,miopenConvolutionFwdAlgoDirect
256-19-258-258-3x3x3-256-17-256-256-1-0x0x0-1x1x1-1x1x1-0-NCDHW-FP16-F=ConvHipImplicitGemm3DGroupFwdXdlops:10.3061,1221498880,miopenConvolutionFwdAlgoImplicitGEMM;ConvDirectNaiveConvFwd:5865.3,0,miopenConvolutionFwdAlgoDirect
256-5-128-192-1x1x1-128-5-128-192-1-0x0x0-1x1x1-1x1x1-0-NCDHW-FP16-F=ConvHipImplicitGemm3DGroupFwdXdlops:0.14818,94437376,miopenConvolutionFwdAlgoImplicitGEMM;GemmFwd1x1_0_1:0.0688602,0,miopenConvolutionFwdAlgoGEMM;ConvDirectNaiveConvFwd:60.0346,0,miopenConvolutionFwdAlgoDirect
256-5-128-256-1x1x1-128-5-128-256-1-0x0x0-1x1x1-1x1x1-0-NCDHW-FP16-F=ConvHipImplicitGemm3DGroupFwdXdlops:0.181087,125894656,miopenConvolutionFwdAlgoImplicitGEMM;GemmFwd1x1_0_1:0.102687,0,miopenConvolutionFwdAlgoGEMM;ConvDirectNaiveConvFwd:81.1553,0,miopenConvolutionFwdAlgoDirect
256-5-130-130-3x3x3-256-3-128-128-1-0x0x0-1x1x1-1x1x1-0-NCDHW-FP16-F=ConvHipImplicitGemm3DGroupFwdXdlops:0.506127,71968768,miopenConvolutionFwdAlgoImplicitGEMM;GemmFwdRest:1.90203,679477248,miopenConvolutionFwdAlgoGEMM;ConvDirectNaiveConvFwd:263.874,0,miopenConvolutionFwdAlgoDirect
256-5-130-66-3x3x3-256-3-128-64-1-0x0x0-1x1x1-1x1x1-0-NCDHW-FP16-F=ConvHipImplicitGemm3DGroupFwdXdlops:0.279821,38086656,miopenConvolutionFwdAlgoImplicitGEMM;GemmFwdRest:0.951116,339738624,miopenConvolutionFwdAlgoGEMM;ConvDirectNaiveConvFwd:140.712,0,miopenConvolutionFwdAlgoDirect
256-5-130-98-3x3x3-256-3-128-96-1-0x0x0-1x1x1-1x1x1-0-NCDHW-FP16-F=ConvHipImplicitGemm3DGroupFwdXdlops:0.34066,55027712,miopenConvolutionFwdAlgoImplicitGEMM;GemmFwdRest:1.3782,509607936,miopenConvolutionFwdAlgoGEMM;ConvDirectNaiveConvFwd:207.558,0,miopenConvolutionFwdAlgoDirect
256-5-144-128-1x1x1-128-5-144-128-1-0x0x0-1x1x1-1x1x1-0-NCDHW-FP16-F=ConvHipImplicitGemm3DGroupFwdXdlops:0.117768,70844416,miopenConvolutionFwdAlgoImplicitGEMM;GemmFwd1x1_0_1:0.0310733,0,miopenConvolutionFwdAlgoGEMM;ConvDirectNaiveConvFwd:45.0187,0,miopenConvolutionFwdAlgoDirect
256-5-144-256-1x1x1-128-5-144-256-1-0x0x0-1x1x1-1x1x1-0-NCDHW-FP16-F=ConvHipImplicitGemm3DGroupFwdXdlops:0.268023,141623296,miopenConvolutionFwdAlgoImplicitGEMM;GemmFwd1x1_0_1:0.0973933,0,miopenConvolutionFwdAlgoGEMM;ConvDirectNaiveConvFwd:91.433,0,miopenConvolutionFwdAlgoDirect
256-5-160-192-1x1x1-128-5-160-192-1-0x0x0-1x1x1-1x1x1-0-NCDHW-FP16-F=ConvHipImplicitGemm3DGroupFwdXdlops:0.17274,118030336,miopenConvolutionFwdAlgoImplicitGEMM;GemmFwd1x1_0_1:0.0750268,0,miopenConvolutionFwdAlgoGEMM;ConvDirectNaiveConvFwd:75.9985,0,miopenConvolutionFwdAlgoDirect
256-5-160-256-1x1x1-128-5-160-256-1-0x0x0-1x1x1-1x1x1-0-NCDHW-FP16-F=ConvHipImplicitGemm3DGroupFwdXdlops:0.291544,157351936,miopenConvolutionFwdAlgoImplicitGEMM;GemmFwd1x1_0_1:0.100067,0,miopenConvolutionFwdAlgoGEMM;ConvDirectNaiveConvFwd:101.645,0,miopenConvolutionFwdAlgoDirect
256-5-256-128-1x1x1-128-5-256-128-1-0x0x0-1x1x1-1x1x1-0-NCDHW-FP16-F=ConvHipImplicitGemm3DGroupFwdXdlops:0.212435,125894656,miopenConvolutionFwdAlgoImplicitGEMM;GemmFwd1x1_0_1:0.102513,0,miopenConvolutionFwdAlgoGEMM;ConvDirectNaiveConvFwd:80.9774,0,miopenConvolutionFwdAlgoDirect
256-5-256-192-1x1x1-128-5-256-192-1-0x0x0-1x1x1-1x1x1-0-NCDHW-FP16-F=ConvHipImplicitGemm3DGroupFwdXdlops:0.327937,188809216,miopenConvolutionFwdAlgoImplicitGEMM;GemmFwd1x1_0_1:0.13056,0,miopenConvolutionFwdAlgoGEMM;ConvDirectNaiveConvFwd:122.004,0,miopenConvolutionFwdAlgoDirect
256-5-256-256-1x1x1-128-5-256-256-1-0x0x0-1x1x1-1x1x1-0-NCDHW-FP16-F=ConvHipImplicitGemm3DGroupFwdXdlops:0.454984,251723776,miopenConvolutionFwdAlgoImplicitGEMM;GemmFwd1x1_0_1:0.17294,0,miopenConvolutionFwdAlgoGEMM;ConvDirectNaiveConvFwd:164.583,0,miopenConvolutionFwdAlgoDirect
256-5-66-130-3x3x3-256-3-64-128-1-0x0x0-1x1x1-1x1x1-0-NCDHW-FP16-F=ConvHipImplicitGemm3DGroupFwdXdlops:0.275194,38086656,miopenConvolutionFwdAlgoImplicitGEMM;GemmFwdRest:0.931521,339738624,miopenConvolutionFwdAlgoGEMM;ConvDirectNaiveConvFwd:134.485,0,miopenConvolutionFwdAlgoDirect
256-5-66-98-3x3x3-256-3-64-96-1-0x0x0-1x1x1-1x1x1-0-NCDHW-FP16-F=ConvHipImplicitGemm3DGroupFwdXdlops:0.19527,29534208,miopenConvolutionFwdAlgoImplicitGEMM;GemmFwdRest:0.632967,254803968,miopenConvolutionFwdAlgoGEMM;ConvDirectNaiveConvFwd:103.703,0,miopenConvolutionFwdAlgoDirect
256-5-74-130-3x3x3-256-3-72-128-1-0x0x0-1x1x1-1x1x1-0-NCDHW-FP16-F=ConvHipImplicitGemm3DGroupFwdXdlops:0.290993,42321920,miopenConvolutionFwdAlgoImplicitGEMM;GemmFwdRest:1.0516,382205952,miopenConvolutionFwdAlgoGEMM;ConvDirectNaiveConvFwd:150.471,0,miopenConvolutionFwdAlgoDirect
256-5-74-66-3x3x3-256-3-72-64-1-0x0x0-1x1x1-1x1x1-0-NCDHW-FP16-F=ConvHipImplicitGemm3DGroupFwdXdlops:0.238178,23119872,miopenConvolutionFwdAlgoImplicitGEMM;GemmFwdRest:0.578949,191102976,miopenConvolutionFwdAlgoGEMM;ConvDirectNaiveConvFwd:79.2727,0,miopenConvolutionFwdAlgoDirect
256-5-82-130-3x3x3-256-3-80-128-1-0x0x0-1x1x1-1x1x1-0-NCDHW-FP16-F=ConvHipImplicitGemm3DGroupFwdXdlops:0.300577,46557184,miopenConvolutionFwdAlgoImplicitGEMM;GemmFwdRest:1.13948,424673280,miopenConvolutionFwdAlgoGEMM;ConvDirectNaiveConvFwd:167.447,0,miopenConvolutionFwdAlgoDirect
256-5-82-98-3x3x3-256-3-80-96-1-0x0x0-1x1x1-1x1x1-0-NCDHW-FP16-F=ConvHipImplicitGemm3DGroupFwdXdlops:0.266408,35907584,miopenConvolutionFwdAlgoImplicitGEMM;GemmFwdRest:0.887704,318504960,miopenConvolutionFwdAlgoGEMM;ConvDirectNaiveConvFwd:129.53,0,miopenConvolutionFwdAlgoDirect
256-7-130-130-3x3x3-256-5-128-128-1-0x0x0-1x1x1-1x1x1-0-NCDHW-FP16-F=ConvHipImplicitGemm3DGroupFwdXdlops:0.736028,106051584,miopenConvolutionFwdAlgoImplicitGEMM;GemmFwdRest:3.11911,1132462080,miopenConvolutionFwdAlgoGEMM;ConvDirectNaiveConvFwd:446.23,0,miopenConvolutionFwdAlgoDirect
256-7-130-194-3x3x3-128-5-128-192-1-0x0x0-1x1x1-1x1x1-0-NCDHW-FP16-F=ConvHipImplicitGemm3DGroupFwdXdlops:0.654454,123615232,miopenConvolutionFwdAlgoImplicitGEMM;GemmFwdRest:3.94177,1698693120,miopenConvolutionFwdAlgoGEMM;ConvDirectNaiveConvFwd:665.989,0,miopenConvolutionFwdAlgoDirect
256-7-130-194-3x3x3-256-5-128-192-1-0x0x0-1x1x1-1x1x1-0-NCDHW-FP16-F=ConvHipImplicitGemm3DGroupFwdXdlops:1.10293,156841984,miopenConvolutionFwdAlgoImplicitGEMM;GemmFwdRest:4.1482,1698693120,miopenConvolutionFwdAlgoGEMM;ConvDirectNaiveConvFwd:652.438,0,miopenConvolutionFwdAlgoDirect
256-7-130-258-3x3x3-128-5-128-256-1-0x0x0-1x1x1-1x1x1-0-NCDHW-FP16-F=ConvHipImplicitGemm3DGroupFwdXdlops:0.90615,163919872,miopenConvolutionFwdAlgoImplicitGEMM;GemmFwdRest:5.47303,2264924160,miopenConvolutionFwdAlgoGEMM;ConvDirectNaiveConvFwd:847.046,0,miopenConvolutionFwdAlgoDirect
256-7-130-258-3x3x3-256-5-128-256-1-0x0x0-1x1x1-1x1x1-0-NCDHW-FP16-F=ConvHipImplicitGemm3DGroupFwdXdlops:1.41972,207632384,miopenConvolutionFwdAlgoImplicitGEMM;GemmFwdRest:5.80338,2264924160,miopenConvolutionFwdAlgoGEMM;ConvDirectNaiveConvFwd:850.391,0,miopenConvolutionFwdAlgoDirect
256-7-130-66-3x3x3-256-5-128-64-1-0x0x0-1x1x1-1x1x1-0-NCDHW-FP16-F=ConvHipImplicitGemm3DGroupFwdXdlops:0.425549,55261184,miopenConvolutionFwdAlgoImplicitGEMM;GemmFwdRest:1.61499,566231040,miopenConvolutionFwdAlgoGEMM;ConvDirectNaiveConvFwd:234.69,0,miopenConvolutionFwdAlgoDirect
256-7-130-98-3x3x3-256-5-128-96-1-0x0x0-1x1x1-1x1x1-0-NCDHW-FP16-F=ConvHipImplicitGemm3DGroupFwdXdlops:0.501025,80656384,miopenConvolutionFwdAlgoImplicitGEMM;GemmFwdRest:2.33146,849346560,miopenConvolutionFwdAlgoGEMM;ConvDirectNaiveConvFwd:346.542,0,miopenConvolutionFwdAlgoDirect
256-7-146-130-3x3x3-128-5-144-128-1-0x0x0-1x1x1-1x1x1-0-NCDHW-FP16-F=ConvHipImplicitGemm3DGroupFwdXdlops:0.515767,93386752,miopenConvolutionFwdAlgoImplicitGEMM;GemmFwdRest:2.90484,1274019840,miopenConvolutionFwdAlgoGEMM;ConvDirectNaiveConvFwd:498.428,0,miopenConvolutionFwdAlgoDirect
256-7-146-130-3x3x3-256-5-144-128-1-0x0x0-1x1x1-1x1x1-0-NCDHW-FP16-F=ConvHipImplicitGemm3DGroupFwdXdlops:0.77355,118749184,miopenConvolutionFwdAlgoImplicitGEMM;GemmFwdRest:3.59441,1274019840,miopenConvolutionFwdAlgoGEMM;ConvDirectNaiveConvFwd:501.356,0,miopenConvolutionFwdAlgoDirect
256-7-146-258-3x3x3-128-5-144-256-1-0x0x0-1x1x1-1x1x1-0-NCDHW-FP16-F=ConvHipImplicitGemm3DGroupFwdXdlops:0.987305,183957504,miopenConvolutionFwdAlgoImplicitGEMM;GemmFwdRest:6.00715,2548039680,miopenConvolutionFwdAlgoGEMM;ConvDirectNaiveConvFwd:954.318,0,miopenConvolutionFwdAlgoDirect
256-7-146-258-3x3x3-256-5-144-256-1-0x0x0-1x1x1-1x1x1-0-NCDHW-FP16-F=ConvHipImplicitGemm3DGroupFwdXdlops:1.59333,232912896,miopenConvolutionFwdAlgoImplicitGEMM;GemmFwdRest:7.14109,2548039680,miopenConvolutionFwdAlgoGEMM;ConvDirectNaiveConvFwd:954.784,0,miopenConvolutionFwdAlgoDirect
256-7-162-194-3x3x3-128-5-160-192-1-0x0x0-1x1x1-1x1x1-0-NCDHW-FP16-F=ConvHipImplicitGemm3DGroupFwdXdlops:0.768265,153729024,miopenConvolutionFwdAlgoImplicitGEMM;GemmFwdRest:5.00737,2123366400,miopenConvolutionFwdAlgoGEMM;ConvDirectNaiveConvFwd:830.263,0,miopenConvolutionFwdAlgoDirect
256-7-162-194-3x3x3-256-5-160-192-1-0x0x0-1x1x1-1x1x1-0-NCDHW-FP16-F=ConvHipImplicitGemm3DGroupFwdXdlops:1.31472,194820096,miopenConvolutionFwdAlgoImplicitGEMM;GemmFwdRest:5.2891,2123366400,miopenConvolutionFwdAlgoGEMM;ConvDirectNaiveConvFwd:813.143,0,miopenConvolutionFwdAlgoDirect
256-7-162-258-3x3x3-128-5-160-256-1-0x0x0-1x1x1-1x1x1-0-NCDHW-FP16-F=ConvHipImplicitGemm3DGroupFwdXdlops:1.08916,203995136,miopenConvolutionFwdAlgoImplicitGEMM;GemmFwdRest:6.82541,2831155200,miopenConvolutionFwdAlgoGEMM;ConvDirectNaiveConvFwd:1059.63,0,miopenConvolutionFwdAlgoDirect
256-7-162-258-3x3x3-256-5-160-256-1-0x0x0-1x1x1-1x1x1-0-NCDHW-FP16-F=ConvHipImplicitGemm3DGroupFwdXdlops:1.83885,258193408,miopenConvolutionFwdAlgoImplicitGEMM;GemmFwdRest:8.09775,2831155200,miopenConvolutionFwdAlgoGEMM;ConvDirectNaiveConvFwd:1062.22,0,miopenConvolutionFwdAlgoDirect
256-7-258-130-3x3x3-128-5-256-128-1-0x0x0-1x1x1-1x1x1-0-NCDHW-FP16-F=ConvHipImplicitGemm3DGroupFwdXdlops:0.897242,163919872,miopenConvolutionFwdAlgoImplicitGEMM;GemmFwdRest:5.5042,2264924160,miopenConvolutionFwdAlgoGEMM;ConvDirectNaiveConvFwd:889.682,0,miopenConvolutionFwdAlgoDirect
256-7-258-130-3x3x3-256-5-256-128-1-0x0x0-1x1x1-1x1x1-0-NCDHW-FP16-F=ConvHipImplicitGemm3DGroupFwdXdlops:1.41475,207632384,miopenConvolutionFwdAlgoImplicitGEMM;GemmFwdRest:5.79012,2264924160,miopenConvolutionFwdAlgoGEMM;ConvDirectNaiveConvFwd:878.874,0,miopenConvolutionFwdAlgoDirect
256-7-258-194-3x3x3-128-5-256-192-1-0x0x0-1x1x1-1x1x1-0-NCDHW-FP16-F=ConvHipImplicitGemm3DGroupFwdXdlops:1.30308,244070400,miopenConvolutionFwdAlgoImplicitGEMM;GemmFwdRest:8.61969,3397386240,miopenConvolutionFwdAlgoGEMM;ConvDirectNaiveConvFwd:1331.63,0,miopenConvolutionFwdAlgoDirect
256-7-258-194-3x3x3-256-5-256-192-1-0x0x0-1x1x1-1x1x1-0-NCDHW-FP16-F=ConvHipImplicitGemm3DGroupFwdXdlops:2.2066,308754432,miopenConvolutionFwdAlgoImplicitGEMM;GemmFwdRest:8.97646,3397386240,miopenConvolutionFwdAlgoGEMM;ConvDirectNaiveConvFwd:1303.65,0,miopenConvolutionFwdAlgoDirect
256-7-258-258-3x3x3-128-5-256-256-1-0x0x0-1x1x1-1x1x1-0-NCDHW-FP16-F=ConvHipImplicitGemm3DGroupFwdXdlops:1.73986,324220928,miopenConvolutionFwdAlgoImplicitGEMM;GemmFwdRest:11.0468,4529848320,miopenConvolutionFwdAlgoGEMM;ConvDirectNaiveConvFwd:1707.16,0,miopenConvolutionFwdAlgoDirect
256-7-258-258-3x3x3-256-5-256-256-1-0x0x0-1x1x1-1x1x1-0-NCDHW-FP16-F=ConvHipImplicitGemm3DGroupFwdXdlops:2.94116,409876480,miopenConvolutionFwdAlgoImplicitGEMM;GemmFwdRest:11.5904,4529848320,miopenConvolutionFwdAlgoGEMM;ConvDirectNaiveConvFwd:1719.71,0,miopenConvolutionFwdAlgoDirect
256-7-66-130-3x3x3-256-5-64-128-1-0x0x0-1x1x1-1x1x1-0-NCDHW-FP16-F=ConvHipImplicitGemm3DGroupFwdXdlops:0.411209,55261184,miopenConvolutionFwdAlgoImplicitGEMM;GemmFwdRest:1.62327,566231040,miopenConvolutionFwdAlgoGEMM;ConvDirectNaiveConvFwd:223.071,0,miopenConvolutionFwdAlgoDirect
256-7-66-98-3x3x3-256-5-64-96-1-0x0x0-1x1x1-1x1x1-0-NCDHW-FP16-F=ConvHipImplicitGemm3DGroupFwdXdlops:0.300552,42448896,miopenConvolutionFwdAlgoImplicitGEMM;GemmFwdRest:1.1197,424673280,miopenConvolutionFwdAlgoGEMM;ConvDirectNaiveConvFwd:173.084,0,miopenConvolutionFwdAlgoDirect
256-7-74-130-3x3x3-256-5-72-128-1-0x0x0-1x1x1-1x1x1-0-NCDHW-FP16-F=ConvHipImplicitGemm3DGroupFwdXdlops:0.443801,61609984,miopenConvolutionFwdAlgoImplicitGEMM;GemmFwdRest:1.7587,637009920,miopenConvolutionFwdAlgoGEMM;ConvDirectNaiveConvFwd:252.896,0,miopenConvolutionFwdAlgoDirect
256-7-74-66-3x3x3-256-5-72-64-1-0x0x0-1x1x1-1x1x1-0-NCDHW-FP16-F=ConvHipImplicitGemm3DGroupFwdXdlops:0.306286,32839680,miopenConvolutionFwdAlgoImplicitGEMM;GemmFwdRest:0.90623,318504960,miopenConvolutionFwdAlgoGEMM;ConvDirectNaiveConvFwd:131.905,0,miopenConvolutionFwdAlgoDirect
256-7-82-130-3x3x3-256-5-80-128-1-0x0x0-1x1x1-1x1x1-0-NCDHW-FP16-F=ConvHipImplicitGemm3DGroupFwdXdlops:0.455021,67958784,miopenConvolutionFwdAlgoImplicitGEMM;GemmFwdRest:1.93883,707788800,miopenConvolutionFwdAlgoGEMM;ConvDirectNaiveConvFwd:280.654,0,miopenConvolutionFwdAlgoDirect
256-7-82-98-3x3x3-256-5-80-96-1-0x0x0-1x1x1-1x1x1-0-NCDHW-FP16-F=ConvHipImplicitGemm3DGroupFwdXdlops:0.370058,52000768,miopenConvolutionFwdAlgoImplicitGEMM;GemmFwdRest:1.46228,530841600,miopenConvolutionFwdAlgoGEMM;ConvDirectNaiveConvFwd:215.161,0,miopenConvolutionFwdAlgoDirect
256-9-128-192-1x1x1-128-9-128-192-1-0x0x0-1x1x1-1x1x1-0-NCDHW-FP16-F=ConvHipImplicitGemm3DGroupFwdXdlops:0.295,169934848,miopenConvolutionFwdAlgoImplicitGEMM;GemmFwd1x1_0_1:0.101673,0,miopenConvolutionFwdAlgoGEMM;ConvDirectNaiveConvFwd:109.834,0,miopenConvolutionFwdAlgoDirect
256-9-128-256-1x1x1-128-9-128-256-1-0x0x0-1x1x1-1x1x1-0-NCDHW-FP16-F=ConvHipImplicitGemm3DGroupFwdXdlops:0.382721,226557952,miopenConvolutionFwdAlgoImplicitGEMM;GemmFwd1x1_0_1:0.145934,0,miopenConvolutionFwdAlgoGEMM;ConvDirectNaiveConvFwd:147.064,0,miopenConvolutionFwdAlgoDirect
256-9-144-128-1x1x1-128-9-144-128-1-0x0x0-1x1x1-1x1x1-0-NCDHW-FP16-F=ConvHipImplicitGemm3DGroupFwdXdlops:0.18038,127467520,miopenConvolutionFwdAlgoImplicitGEMM;GemmFwd1x1_0_1:0.1018,0,miopenConvolutionFwdAlgoGEMM;ConvDirectNaiveConvFwd:82.2214,0,miopenConvolutionFwdAlgoDirect
256-9-144-256-1x1x1-128-9-144-256-1-0x0x0-1x1x1-1x1x1-0-NCDHW-FP16-F=ConvHipImplicitGemm3DGroupFwdXdlops:0.458101,254869504,miopenConvolutionFwdAlgoImplicitGEMM;GemmFwd1x1_0_1:0.173992,0,miopenConvolutionFwdAlgoGEMM;ConvDirectNaiveConvFwd:166.407,0,miopenConvolutionFwdAlgoDirect
256-9-160-192-1x1x1-128-9-160-192-1-0x0x0-1x1x1-1x1x1-0-NCDHW-FP16-F=ConvHipImplicitGemm3DGroupFwdXdlops:0.359921,212402176,miopenConvolutionFwdAlgoImplicitGEMM;GemmFwd1x1_0_1:0.1399,0,miopenConvolutionFwdAlgoGEMM;ConvDirectNaiveConvFwd:137.746,0,miopenConvolutionFwdAlgoDirect
256-9-160-256-1x1x1-128-9-160-256-1-0x0x0-1x1x1-1x1x1-0-NCDHW-FP16-F=ConvHipImplicitGemm3DGroupFwdXdlops:0.477341,283181056,miopenConvolutionFwdAlgoImplicitGEMM;GemmFwd1x1_0_1:0.186216,0,miopenConvolutionFwdAlgoGEMM;ConvDirectNaiveConvFwd:192.7,0,miopenConvolutionFwdAlgoDirect
256-9-256-128-1x1x1-128-9-256-128-1-0x0x0-1x1x1-1x1x1-0-NCDHW-FP16-F=ConvHipImplicitGemm3DGroupFwdXdlops:0.38809,226557952,miopenConvolutionFwdAlgoImplicitGEMM;GemmFwd1x1_0_1:0.145048,0,miopenConvolutionFwdAlgoGEMM;ConvDirectNaiveConvFwd:147.073,0,miopenConvolutionFwdAlgoDirect
256-9-256-192-1x1x1-128-9-256-192-1-0x0x0-1x1x1-1x1x1-0-NCDHW-FP16-F=ConvHipImplicitGemm3DGroupFwdXdlops:0.580649,339804160,miopenConvolutionFwdAlgoImplicitGEMM;GemmFwd1x1_0_1:0.252627,0,miopenConvolutionFwdAlgoGEMM;ConvDirectNaiveConvFwd:270.862,0,miopenConvolutionFwdAlgoDirect
256-9-256-256-1x1x1-128-9-256-256-1-0x0x0-1x1x1-1x1x1-0-NCDHW-FP16-F=ConvHipImplicitGemm3DGroupFwdXdlops:0.786551,453050368,miopenConvolutionFwdAlgoImplicitGEMM;GemmFwd1x1_0_1:0.337167,0,miopenConvolutionFwdAlgoGEMM;ConvDirectNaiveConvFwd:364.096,0,miopenConvolutionFwdAlgoDirect
512-11-130-130-3x3x3-256-9-128-128-1-0x0x0-1x1x1-1x1x1-0-NCDHW-FP16-F=ConvHipImplicitGemm3DGroupFwdXdlops:2.59062,272936960,miopenConvolutionFwdAlgoImplicitGEMM;GemmFwdRest:10.4187,4076863488,miopenConvolutionFwdAlgoGEMM;ConvDirectNaiveConvFwd:1610.01,0,miopenConvolutionFwdAlgoDirect
512-11-130-130-3x3x3-512-9-128-128-1-0x0x0-1x1x1-1x1x1-0-NCDHW-FP16-F=ConvHipImplicitGemm3DGroupFwdXdlops:4.4939,355512320,miopenConvolutionFwdAlgoImplicitGEMM;GemmFwdRest:12.4537,4076863488,miopenConvolutionFwdAlgoGEMM;ConvDirectNaiveConvFwd:1843.24,0,miopenConvolutionFwdAlgoDirect
512-11-130-66-3x3x3-256-9-128-64-1-0x0x0-1x1x1-1x1x1-0-NCDHW-FP16-F=ConvHipImplicitGemm3DGroupFwdXdlops:1.17265,141471744,miopenConvolutionFwdAlgoImplicitGEMM;GemmFwdRest:5.8403,2038431744,miopenConvolutionFwdAlgoGEMM;ConvDirectNaiveConvFwd:844.319,0,miopenConvolutionFwdAlgoDirect
512-11-130-66-3x3x3-512-9-128-64-1-0x0x0-1x1x1-1x1x1-0-NCDHW-FP16-F=ConvHipImplicitGemm3DGroupFwdXdlops:2.23661,186298368,miopenConvolutionFwdAlgoImplicitGEMM;GemmFwdRest:7.36631,2038431744,miopenConvolutionFwdAlgoGEMM;ConvDirectNaiveConvFwd:844.417,0,miopenConvolutionFwdAlgoDirect
512-11-130-98-3x3x3-256-9-128-96-1-0x0x0-1x1x1-1x1x1-0-NCDHW-FP16-F=ConvHipImplicitGemm3DGroupFwdXdlops:1.88234,207204352,miopenConvolutionFwdAlgoImplicitGEMM;GemmFwdRest:7.81425,3057647616,miopenConvolutionFwdAlgoGEMM;ConvDirectNaiveConvFwd:1237.83,0,miopenConvolutionFwdAlgoDirect
512-11-130-98-3x3x3-512-9-128-96-1-0x0x0-1x1x1-1x1x1-0-NCDHW-FP16-F=ConvHipImplicitGemm3DGroupFwdXdlops:3.41269,270905344,miopenConvolutionFwdAlgoImplicitGEMM;GemmFwdRest:9.37083,3057647616,miopenConvolutionFwdAlgoGEMM;ConvDirectNaiveConvFwd:1379.35,0,miopenConvolutionFwdAlgoDirect
512-11-66-130-3x3x3-256-9-64-128-1-0x0x0-1x1x1-1x1x1-0-NCDHW-FP16-F=ConvHipImplicitGemm3DGroupFwdXdlops:1.25403,141471744,miopenConvolutionFwdAlgoImplicitGEMM;GemmFwdRest:5.92682,2038431744,miopenConvolutionFwdAlgoGEMM;ConvDirectNaiveConvFwd:804,0,miopenConvolutionFwdAlgoDirect
512-11-66-130-3x3x3-512-9-64-128-1-0x0x0-1x1x1-1x1x1-0-NCDHW-FP16-F=ConvHipImplicitGemm3DGroupFwdXdlops:2.257,186298368,miopenConvolutionFwdAlgoImplicitGEMM;GemmFwdRest:7.36797,2038431744,miopenConvolutionFwdAlgoGEMM;ConvDirectNaiveConvFwd:819.47,0,miopenConvolutionFwdAlgoDirect
512-11-66-98-3x3x3-256-9-64-96-1-0x0x0-1x1x1-1x1x1-0-NCDHW-FP16-F=ConvHipImplicitGemm3DGroupFwdXdlops:0.924408,108244992,miopenConvolutionFwdAlgoImplicitGEMM;GemmFwdRest:4.3392,1528823808,miopenConvolutionFwdAlgoGEMM;ConvDirectNaiveConvFwd:616.432,0,miopenConvolutionFwdAlgoDirect
512-11-66-98-3x3x3-512-9-64-96-1-0x0x0-1x1x1-1x1x1-0-NCDHW-FP16-F=ConvHipImplicitGemm3DGroupFwdXdlops:1.78277,143634432,miopenConvolutionFwdAlgoImplicitGEMM;GemmFwdRest:5.34477,1528823808,miopenConvolutionFwdAlgoGEMM;ConvDirectNaiveConvFwd:673.745,0,miopenConvolutionFwdAlgoDirect
512-11-74-130-3x3x3-256-9-72-128-1-0x0x0-1x1x1-1x1x1-0-NCDHW-FP16-F=ConvHipImplicitGemm3DGroupFwdXdlops:1.49083,157904896,miopenConvolutionFwdAlgoImplicitGEMM;GemmFwdRest:6.74884,2293235712,miopenConvolutionFwdAlgoGEMM;ConvDirectNaiveConvFwd:909.048,0,miopenConvolutionFwdAlgoDirect
512-11-74-130-3x3x3-512-9-72-128-1-0x0x0-1x1x1-1x1x1-0-NCDHW-FP16-F=ConvHipImplicitGemm3DGroupFwdXdlops:2.66808,207450112,miopenConvolutionFwdAlgoImplicitGEMM;GemmFwdRest:8.34499,2293235712,miopenConvolutionFwdAlgoGEMM;ConvDirectNaiveConvFwd:965.268,0,miopenConvolutionFwdAlgoDirect
512-11-74-66-3x3x3-256-9-72-64-1-0x0x0-1x1x1-1x1x1-0-NCDHW-FP16-F=ConvHipImplicitGemm3DGroupFwdXdlops:0.802801,83324928,miopenConvolutionFwdAlgoImplicitGEMM;GemmFwdRest:3.31013,1146617856,miopenConvolutionFwdAlgoGEMM;ConvDirectNaiveConvFwd:476.134,0,miopenConvolutionFwdAlgoDirect
512-11-74-66-3x3x3-512-9-72-64-1-0x0x0-1x1x1-1x1x1-0-NCDHW-FP16-F=ConvHipImplicitGemm3DGroupFwdXdlops:1.33549,111636480,miopenConvolutionFwdAlgoImplicitGEMM;GemmFwdRest:4.01012,1146617856,miopenConvolutionFwdAlgoGEMM;ConvDirectNaiveConvFwd:476.503,0,miopenConvolutionFwdAlgoDirect
512-11-82-130-3x3x3-256-9-80-128-1-0x0x0-1x1x1-1x1x1-0-NCDHW-FP16-F=ConvHipImplicitGemm3DGroupFwdXdlops:1.5438,174338048,miopenConvolutionFwdAlgoImplicitGEMM;GemmFwdRest:7.41429,2548039680,miopenConvolutionFwdAlgoGEMM;ConvDirectNaiveConvFwd:1001.51,0,miopenConvolutionFwdAlgoDirect
512-11-82-130-3x3x3-512-9-80-128-1-0x0x0-1x1x1-1x1x1-0-NCDHW-FP16-F=ConvHipImplicitGemm3DGroupFwdXdlops:2.9618,228601856,miopenConvolutionFwdAlgoImplicitGEMM;GemmFwdRest:9.29595,2548039680,miopenConvolutionFwdAlgoGEMM;ConvDirectNaiveConvFwd:1079.41,0,miopenConvolutionFwdAlgoDirect
512-11-82-98-3x3x3-256-9-80-96-1-0x0x0-1x1x1-1x1x1-0-NCDHW-FP16-F=ConvHipImplicitGemm3DGroupFwdXdlops:1.12412,132984832,miopenConvolutionFwdAlgoImplicitGEMM;GemmFwdRest:5.47594,1911029760,miopenConvolutionFwdAlgoGEMM;ConvDirectNaiveConvFwd:777.54,0,miopenConvolutionFwdAlgoDirect
512-11-82-98-3x3x3-512-9-80-96-1-0x0x0-1x1x1-1x1x1-0-NCDHW-FP16-F=ConvHipImplicitGemm3DGroupFwdXdlops:2.10653,175452160,miopenConvolutionFwdAlgoImplicitGEMM;GemmFwdRest:6.89667,1911029760,miopenConvolutionFwdAlgoGEMM;ConvDirectNaiveConvFwd:862.09,0,miopenConvolutionFwdAlgoDirect
512-3-128-128-1x1x1-256-3-128-128-1-0x0x0-1x1x1-1x1x1-0-NCDHW-FP16-F=ConvHipImplicitGemm3DGroupFwdXdlops:0.124336,75759616,miopenConvolutionFwdAlgoImplicitGEMM;GemmFwd1x1_0_1:0.0469467,0,miopenConvolutionFwdAlgoGEMM;ConvDirectNaiveConvFwd:47.8881,0,miopenConvolutionFwdAlgoDirect
512-3-128-64-1x1x1-256-3-128-64-1-0x0x0-1x1x1-1x1x1-0-NCDHW-FP16-F=ConvHipImplicitGemm3DGroupFwdXdlops:0.0769868,38010880,miopenConvolutionFwdAlgoImplicitGEMM;GemmFwd1x1_0_1:0.0276267,0,miopenConvolutionFwdAlgoGEMM;ConvDirectNaiveConvFwd:23.894,0,miopenConvolutionFwdAlgoDirect
512-3-128-96-1x1x1-256-3-128-96-1-0x0x0-1x1x1-1x1x1-0-NCDHW-FP16-F=ConvHipImplicitGemm3DGroupFwdXdlops:0.125263,56885248,miopenConvolutionFwdAlgoImplicitGEMM;GemmFwd1x1_0_1:0.03504,0,miopenConvolutionFwdAlgoGEMM;ConvDirectNaiveConvFwd:35.8918,0,miopenConvolutionFwdAlgoDirect
512-3-64-128-1x1x1-256-3-64-128-1-0x0x0-1x1x1-1x1x1-0-NCDHW-FP16-F=ConvHipImplicitGemm3DGroupFwdXdlops:0.0775204,38010880,miopenConvolutionFwdAlgoImplicitGEMM;GemmFwd1x1_0_1:0.0275867,0,miopenConvolutionFwdAlgoGEMM;ConvDirectNaiveConvFwd:23.9228,0,miopenConvolutionFwdAlgoDirect
512-3-64-96-1x1x1-256-3-64-96-1-0x0x0-1x1x1-1x1x1-0-NCDHW-FP16-F=ConvHipImplicitGemm3DGroupFwdXdlops:0.0635103,28573696,miopenConvolutionFwdAlgoImplicitGEMM;GemmFwd1x1_0_1:0.018512,0,miopenConvolutionFwdAlgoGEMM;ConvDirectNaiveConvFwd:17.919,0,miopenConvolutionFwdAlgoDirect
512-3-72-128-1x1x1-256-3-72-128-1-0x0x0-1x1x1-1x1x1-0-NCDHW-FP16-F=ConvHipImplicitGemm3DGroupFwdXdlops:0.103275,42729472,miopenConvolutionFwdAlgoImplicitGEMM;GemmFwd1x1_0_1:0.0292,0,miopenConvolutionFwdAlgoGEMM;ConvDirectNaiveConvFwd:27.0349,0,miopenConvolutionFwdAlgoDirect
512-3-72-64-1x1x1-256-3-72-64-1-0x0x0-1x1x1-1x1x1-0-NCDHW-FP16-F=ConvHipImplicitGemm3DGroupFwdXdlops:0.0543202,21495808,miopenConvolutionFwdAlgoImplicitGEMM;GemmFwd1x1_0_1:0.02223,0,miopenConvolutionFwdAlgoGEMM;ConvDirectNaiveConvFwd:13.4897,0,miopenConvolutionFwdAlgoDirect
512-3-80-128-1x1x1-256-3-80-128-1-0x0x0-1x1x1-1x1x1-0-NCDHW-FP16-F=ConvHipImplicitGemm3DGroupFwdXdlops:0.0918962,47448064,miopenConvolutionFwdAlgoImplicitGEMM;GemmFwd1x1_0_1:0.031008,0,miopenConvolutionFwdAlgoGEMM;ConvDirectNaiveConvFwd:29.8914,0,miopenConvolutionFwdAlgoDirect
512-3-80-96-1x1x1-256-3-80-96-1-0x0x0-1x1x1-1x1x1-0-NCDHW-FP16-F=ConvHipImplicitGemm3DGroupFwdXdlops:0.0756482,35651584,miopenConvolutionFwdAlgoImplicitGEMM;GemmFwd1x1_0_1:0.0276467,0,miopenConvolutionFwdAlgoGEMM;ConvDirectNaiveConvFwd:22.5357,0,miopenConvolutionFwdAlgoDirect
512-4-18-26-3x3x3-512-2-16-24-1-0x0x0-1x1x1-1x1x1-0-NCDHW-FP16-F=ConvHipImplicitGemm3DGroupFwdXdlops:0.150697,16859136,miopenConvolutionFwdAlgoImplicitGEMM;GemmFwdRest:0.454087,21233664,miopenConvolutionFwdAlgoGEMM;ConvDirectNaiveConvFwd:7.62747,0,miopenConvolutionFwdAlgoDirect
512-4-18-34-3x3x3-512-2-16-32-1-0x0x0-1x1x1-1x1x1-0-NCDHW-FP16-F=ConvHipImplicitGemm3DGroupFwdXdlops:0.169789,17711104,miopenConvolutionFwdAlgoImplicitGEMM;GemmFwdRest:0.465154,28311552,miopenConvolutionFwdAlgoGEMM;ConvDirectNaiveConvFwd:10.2869,0,miopenConvolutionFwdAlgoDirect
512-4-20-18-3x3x3-512-2-18-16-1-0x0x0-1x1x1-1x1x1-0-NCDHW-FP16-F=ConvHipImplicitGemm3DGroupFwdXdlops:0.130256,16220160,miopenConvolutionFwdAlgoImplicitGEMM;GemmFwdRest:0.449207,15925248,miopenConvolutionFwdAlgoGEMM;ConvDirectNaiveConvFwd:7.37767,0,miopenConvolutionFwdAlgoDirect
512-4-20-34-3x3x3-512-2-18-32-1-0x0x0-1x1x1-1x1x1-0-NCDHW-FP16-F=ConvHipImplicitGemm3DGroupFwdXdlops:0.153773,18120704,miopenConvolutionFwdAlgoImplicitGEMM;GemmFwdRest:0.469927,31850496,miopenConvolutionFwdAlgoGEMM;ConvDirectNaiveConvFwd:12.9616,0,miopenConvolutionFwdAlgoDirect
512-4-22-26-3x3x3-512-2-20-24-1-0x0x0-1x1x1-1x1x1-0-NCDHW-FP16-F=ConvHipImplicitGemm3DGroupFwdXdlops:0.14912,17481728,miopenConvolutionFwdAlgoImplicitGEMM;GemmFwdRest:0.463208,26542080,miopenConvolutionFwdAlgoGEMM;ConvDirectNaiveConvFwd:10.2195,0,miopenConvolutionFwdAlgoDirect
512-4-22-34-3x3x3-512-2-20-32-1-0x0x0-1x1x1-1x1x1-0-NCDHW-FP16-F=ConvHipImplicitGemm3DGroupFwdXdlops:0.17636,18530304,miopenConvolutionFwdAlgoImplicitGEMM;GemmFwdRest:0.473888,35389440,miopenConvolutionFwdAlgoGEMM;ConvDirectNaiveConvFwd:13.1393,0,miopenConvolutionFwdAlgoDirect
512-4-34-18-3x3x3-512-2-32-16-1-0x0x0-1x1x1-1x1x1-0-NCDHW-FP16-F=ConvHipImplicitGemm3DGroupFwdXdlops:0.167972,17711104,miopenConvolutionFwdAlgoImplicitGEMM;GemmFwdRest:0.46418,28311552,miopenConvolutionFwdAlgoGEMM;ConvDirectNaiveConvFwd:10.2195,0,miopenConvolutionFwdAlgoDirect
512-4-34-26-3x3x3-512-2-32-24-1-0x0x0-1x1x1-1x1x1-0-NCDHW-FP16-F=ConvHipImplicitGemm3DGroupFwdXdlops:0.194423,19349504,miopenConvolutionFwdAlgoImplicitGEMM;GemmFwdRest:0.484667,42467328,miopenConvolutionFwdAlgoGEMM;ConvDirectNaiveConvFwd:15.7808,0,miopenConvolutionFwdAlgoDirect
512-4-34-34-3x3x3-512-2-32-32-1-0x0x0-1x1x1-1x1x1-0-NCDHW-FP16-F=ConvHipImplicitGemm3DGroupFwdXdlops:0.198852,20987904,miopenConvolutionFwdAlgoImplicitGEMM;GemmFwdRest:0.509288,56623104,miopenConvolutionFwdAlgoGEMM;ConvDirectNaiveConvFwd:21.6099,0,miopenConvolutionFwdAlgoDirect
512-4-34-50-3x3x3-512-2-32-48-1-0x0x0-1x1x1-1x1x1-0-NCDHW-FP16-F=ConvHipImplicitGemm3DGroupFwdXdlops:0.22016,24264704,miopenConvolutionFwdAlgoImplicitGEMM;GemmFwdRest:0.553567,84934656,miopenConvolutionFwdAlgoGEMM;ConvDirectNaiveConvFwd:33.763,0,miopenConvolutionFwdAlgoDirect
512-4-34-66-3x3x3-512-2-32-64-1-0x0x0-1x1x1-1x1x1-0-NCDHW-FP16-F=ConvHipImplicitGemm3DGroupFwdXdlops:0.22394,27541504,miopenConvolutionFwdAlgoImplicitGEMM;GemmFwdRest:0.594201,113246208,miopenConvolutionFwdAlgoGEMM;ConvDirectNaiveConvFwd:47.2128,0,miopenConvolutionFwdAlgoDirect
512-4-38-34-3x3x3-512-2-36-32-1-0x0x0-1x1x1-1x1x1-0-NCDHW-FP16-F=ConvHipImplicitGemm3DGroupFwdXdlops:0.23124,21807104,miopenConvolutionFwdAlgoImplicitGEMM;GemmFwdRest:0.518889,63700992,miopenConvolutionFwdAlgoGEMM;ConvDirectNaiveConvFwd:24.412,0,miopenConvolutionFwdAlgoDirect
512-4-38-66-3x3x3-512-2-36-64-1-0x0x0-1x1x1-1x1x1-0-NCDHW-FP16-F=ConvHipImplicitGemm3DGroupFwdXdlops:0.260018,29147136,miopenConvolutionFwdAlgoImplicitGEMM;GemmFwdRest:0.628594,127401984,miopenConvolutionFwdAlgoGEMM;ConvDirectNaiveConvFwd:52.9746,0,miopenConvolutionFwdAlgoDirect
512-4-42-50-3x3x3-512-2-40-48-1-0x0x0-1x1x1-1x1x1-0-NCDHW-FP16-F=ConvHipImplicitGemm3DGroupFwdXdlops:0.22648,26689536,miopenConvolutionFwdAlgoImplicitGEMM;GemmFwdRest:0.586745,106168320,miopenConvolutionFwdAlgoGEMM;ConvDirectNaiveConvFwd:41.9983,0,miopenConvolutionFwdAlgoDirect
512-4-42-66-3x3x3-512-2-40-64-1-0x0x0-1x1x1-1x1x1-0-NCDHW-FP16-F=ConvHipImplicitGemm3DGroupFwdXdlops:0.250376,30752768,miopenConvolutionFwdAlgoImplicitGEMM;GemmFwdRest:0.659061,141557760,miopenConvolutionFwdAlgoGEMM;ConvDirectNaiveConvFwd:58.8619,0,miopenConvolutionFwdAlgoDirect
512-4-66-34-3x3x3-512-2-64-32-1-0x0x0-1x1x1-1x1x1-0-NCDHW-FP16-F=ConvHipImplicitGemm3DGroupFwdXdlops:0.22752,27541504,miopenConvolutionFwdAlgoImplicitGEMM;GemmFwdRest:0.598754,113246208,miopenConvolutionFwdAlgoGEMM;ConvDirectNaiveConvFwd:43.509,0,miopenConvolutionFwdAlgoDirect
512-4-66-50-3x3x3-512-2-64-48-1-0x0x0-1x1x1-1x1x1-0-NCDHW-FP16-F=ConvHipImplicitGemm3DGroupFwdXdlops:0.283414,33964032,miopenConvolutionFwdAlgoImplicitGEMM;GemmFwdRest:0.723327,169869312,miopenConvolutionFwdAlgoGEMM;ConvDirectNaiveConvFwd:68.1613,0,miopenConvolutionFwdAlgoDirect
512-4-66-66-3x3x3-512-2-64-64-1-0x0x0-1x1x1-1x1x1-0-NCDHW-FP16-F=ConvHipImplicitGemm3DGroupFwdXdlops:0.357841,40386560,miopenConvolutionFwdAlgoImplicitGEMM;GemmFwdRest:0.852418,226492416,miopenConvolutionFwdAlgoGEMM;ConvDirectNaiveConvFwd:93.8861,0,miopenConvolutionFwdAlgoDirect
512-5-128-128-1x1x1-256-5-128-128-1-0x0x0-1x1x1-1x1x1-0-NCDHW-FP16-F=ConvHipImplicitGemm3DGroupFwdXdlops:0.193832,126091264,miopenConvolutionFwdAlgoImplicitGEMM;GemmFwd1x1_0_1:0.0795267,0,miopenConvolutionFwdAlgoGEMM;ConvDirectNaiveConvFwd:80.524,0,miopenConvolutionFwdAlgoDirect
512-5-128-64-1x1x1-256-5-128-64-1-0x0x0-1x1x1-1x1x1-0-NCDHW-FP16-F=ConvHipImplicitGemm3DGroupFwdXdlops:0.11322,63176704,miopenConvolutionFwdAlgoImplicitGEMM;GemmFwd1x1_0_1:0.0444467,0,miopenConvolutionFwdAlgoGEMM;ConvDirectNaiveConvFwd:39.8653,0,miopenConvolutionFwdAlgoDirect
512-5-128-96-1x1x1-256-5-128-96-1-0x0x0-1x1x1-1x1x1-0-NCDHW-FP16-F=ConvHipImplicitGemm3DGroupFwdXdlops:0.14823,94633984,miopenConvolutionFwdAlgoImplicitGEMM;GemmFwd1x1_0_1:0.0622868,0,miopenConvolutionFwdAlgoGEMM;ConvDirectNaiveConvFwd:59.872,0,miopenConvolutionFwdAlgoDirect
512-5-130-130-3x3x3-256-3-128-128-1-0x0x0-1x1x1-1x1x1-0-NCDHW-FP16-F=ConvHipImplicitGemm3DGroupFwdXdlops:0.902801,118771712,miopenConvolutionFwdAlgoImplicitGEMM;GemmFwdRest:3.90086,1358954496,miopenConvolutionFwdAlgoGEMM;ConvDirectNaiveConvFwd:537.54,0,miopenConvolutionFwdAlgoDirect
512-5-130-130-3x3x3-512-3-128-128-1-0x0x0-1x1x1-1x1x1-0-NCDHW-FP16-F=ConvHipImplicitGemm3DGroupFwdXdlops:1.64549,151015424,miopenConvolutionFwdAlgoImplicitGEMM;GemmFwdRest:4.68478,1358954496,miopenConvolutionFwdAlgoGEMM;ConvDirectNaiveConvFwd:553.105,0,miopenConvolutionFwdAlgoDirect
512-5-130-66-3x3x3-256-3-128-64-1-0x0x0-1x1x1-1x1x1-0-NCDHW-FP16-F=ConvHipImplicitGemm3DGroupFwdXdlops:0.511072,63590400,miopenConvolutionFwdAlgoImplicitGEMM;GemmFwdRest:1.90254,679477248,miopenConvolutionFwdAlgoGEMM;ConvDirectNaiveConvFwd:281.441,0,miopenConvolutionFwdAlgoDirect
512-5-130-66-3x3x3-512-3-128-64-1-0x0x0-1x1x1-1x1x1-0-NCDHW-FP16-F=ConvHipImplicitGemm3DGroupFwdXdlops:0.811607,83251200,miopenConvolutionFwdAlgoImplicitGEMM;GemmFwdRest:2.2402,679477248,miopenConvolutionFwdAlgoGEMM;ConvDirectNaiveConvFwd:281.922,0,miopenConvolutionFwdAlgoDirect
512-5-130-98-3x3x3-256-3-128-96-1-0x0x0-1x1x1-1x1x1-0-NCDHW-FP16-F=ConvHipImplicitGemm3DGroupFwdXdlops:0.630435,91181056,miopenConvolutionFwdAlgoImplicitGEMM;GemmFwdRest:2.76745,1019215872,miopenConvolutionFwdAlgoGEMM;ConvDirectNaiveConvFwd:413.672,0,miopenConvolutionFwdAlgoDirect
512-5-130-98-3x3x3-512-3-128-96-1-0x0x0-1x1x1-1x1x1-0-NCDHW-FP16-F=ConvHipImplicitGemm3DGroupFwdXdlops:1.07161,117133312,miopenConvolutionFwdAlgoImplicitGEMM;GemmFwdRest:3.35246,1019215872,miopenConvolutionFwdAlgoGEMM;ConvDirectNaiveConvFwd:425.05,0,miopenConvolutionFwdAlgoDirect
512-5-18-26-3x3x3-512-3-16-24-1-0x0x0-1x1x1-1x1x1-0-NCDHW-FP16-F=ConvHipImplicitGemm3DGroupFwdXdlops:0.147928,17731584,miopenConvolutionFwdAlgoImplicitGEMM;GemmFwdRest:0.472294,31850496,miopenConvolutionFwdAlgoGEMM;ConvDirectNaiveConvFwd:12.8402,0,miopenConvolutionFwdAlgoDirect
512-5-18-34-3x3x3-512-3-16-32-1-0x0x0-1x1x1-1x1x1-0-NCDHW-FP16-F=ConvHipImplicitGemm3DGroupFwdXdlops:0.181577,18862080,miopenConvolutionFwdAlgoImplicitGEMM;GemmFwdRest:0.486501,42467328,miopenConvolutionFwdAlgoGEMM;ConvDirectNaiveConvFwd:15.7337,0,miopenConvolutionFwdAlgoDirect
512-5-20-18-3x3x3-512-3-18-16-1-0x0x0-1x1x1-1x1x1-0-NCDHW-FP16-F=ConvHipImplicitGemm3DGroupFwdXdlops:0.149454,16883712,miopenConvolutionFwdAlgoImplicitGEMM;GemmFwdRest:0.458774,23887872,miopenConvolutionFwdAlgoGEMM;ConvDirectNaiveConvFwd:10.1068,0,miopenConvolutionFwdAlgoDirect
512-5-20-34-3x3x3-512-3-18-32-1-0x0x0-1x1x1-1x1x1-0-NCDHW-FP16-F=ConvHipImplicitGemm3DGroupFwdXdlops:0.193912,19406848,miopenConvolutionFwdAlgoImplicitGEMM;GemmFwdRest:0.492267,47775744,miopenConvolutionFwdAlgoGEMM;ConvDirectNaiveConvFwd:18.4418,0,miopenConvolutionFwdAlgoDirect
512-5-22-26-3x3x3-512-3-20-24-1-0x0x0-1x1x1-1x1x1-0-NCDHW-FP16-F=ConvHipImplicitGemm3DGroupFwdXdlops:0.175016,18558976,miopenConvolutionFwdAlgoImplicitGEMM;GemmFwdRest:0.481748,39813120,miopenConvolutionFwdAlgoGEMM;ConvDirectNaiveConvFwd:15.5087,0,miopenConvolutionFwdAlgoDirect
512-5-22-34-3x3x3-512-3-20-32-1-0x0x0-1x1x1-1x1x1-0-NCDHW-FP16-F=ConvHipImplicitGemm3DGroupFwdXdlops:0.1958,19951616,miopenConvolutionFwdAlgoImplicitGEMM;GemmFwdRest:0.501254,53084160,miopenConvolutionFwdAlgoGEMM;ConvDirectNaiveConvFwd:21.2307,0,miopenConvolutionFwdAlgoDirect
512-5-34-18-3x3x3-512-3-32-16-1-0x0x0-1x1x1-1x1x1-0-NCDHW-FP16-F=ConvHipImplicitGemm3DGroupFwdXdlops:0.195,18862080,miopenConvolutionFwdAlgoImplicitGEMM;GemmFwdRest:0.485941,42467328,miopenConvolutionFwdAlgoGEMM;ConvDirectNaiveConvFwd:15.3893,0,miopenConvolutionFwdAlgoDirect
512-5-34-26-3x3x3-512-3-32-24-1-0x0x0-1x1x1-1x1x1-0-NCDHW-FP16-F=ConvHipImplicitGemm3DGroupFwdXdlops:0.207486,21041152,miopenConvolutionFwdAlgoImplicitGEMM;GemmFwdRest:0.518687,63700992,miopenConvolutionFwdAlgoGEMM;ConvDirectNaiveConvFwd:23.9436,0,miopenConvolutionFwdAlgoDirect
512-5-34-34-3x3x3-512-3-32-32-1-0x0x0-1x1x1-1x1x1-0-NCDHW-FP16-F=ConvHipImplicitGemm3DGroupFwdXdlops:0.218263,23220224,miopenConvolutionFwdAlgoImplicitGEMM;GemmFwdRest:0.551554,84934656,miopenConvolutionFwdAlgoGEMM;ConvDirectNaiveConvFwd:32.5972,0,miopenConvolutionFwdAlgoDirect
512-5-34-50-3x3x3-512-3-32-48-1-0x0x0-1x1x1-1x1x1-0-NCDHW-FP16-F=ConvHipImplicitGemm3DGroupFwdXdlops:0.29284,27578368,miopenConvolutionFwdAlgoImplicitGEMM;GemmFwdRest:0.632214,127401984,miopenConvolutionFwdAlgoGEMM;ConvDirectNaiveConvFwd:50.9262,0,miopenConvolutionFwdAlgoDirect
512-5-34-66-3x3x3-512-3-32-64-1-0x0x0-1x1x1-1x1x1-0-NCDHW-FP16-F=ConvHipImplicitGemm3DGroupFwdXdlops:0.25719,31936512,miopenConvolutionFwdAlgoImplicitGEMM;GemmFwdRest:0.727858,169869312,miopenConvolutionFwdAlgoGEMM;ConvDirectNaiveConvFwd:70.7208,0,miopenConvolutionFwdAlgoDirect
512-5-38-34-3x3x3-512-3-36-32-1-0x0x0-1x1x1-1x1x1-0-NCDHW-FP16-F=ConvHipImplicitGemm3DGroupFwdXdlops:0.219452,24309760,miopenConvolutionFwdAlgoImplicitGEMM;GemmFwdRest:0.569221,95551488,miopenConvolutionFwdAlgoGEMM;ConvDirectNaiveConvFwd:38.0768,0,miopenConvolutionFwdAlgoDirect
512-5-38-66-3x3x3-512-3-36-64-1-0x0x0-1x1x1-1x1x1-0-NCDHW-FP16-F=ConvHipImplicitGemm3DGroupFwdXdlops:0.288577,34074624,miopenConvolutionFwdAlgoImplicitGEMM;GemmFwdRest:0.782293,191102976,miopenConvolutionFwdAlgoGEMM;ConvDirectNaiveConvFwd:79.5404,0,miopenConvolutionFwdAlgoDirect
512-5-42-50-3x3x3-512-3-40-48-1-0x0x0-1x1x1-1x1x1-0-NCDHW-FP16-F=ConvHipImplicitGemm3DGroupFwdXdlops:0.269075,30806016,miopenConvolutionFwdAlgoImplicitGEMM;GemmFwdRest:0.708384,159252480,miopenConvolutionFwdAlgoGEMM;ConvDirectNaiveConvFwd:64.3483,0,miopenConvolutionFwdAlgoDirect
512-5-42-66-3x3x3-512-3-40-64-1-0x0x0-1x1x1-1x1x1-0-NCDHW-FP16-F=ConvHipImplicitGemm3DGroupFwdXdlops:0.322067,36212736,miopenConvolutionFwdAlgoImplicitGEMM;GemmFwdRest:0.840921,212336640,miopenConvolutionFwdAlgoGEMM;ConvDirectNaiveConvFwd:88.1822,0,miopenConvolutionFwdAlgoDirect
512-5-64-128-1x1x1-256-5-64-128-1-0x0x0-1x1x1-1x1x1-0-NCDHW-FP16-F=ConvHipImplicitGemm3DGroupFwdXdlops:0.11512,63176704,miopenConvolutionFwdAlgoImplicitGEMM;GemmFwd1x1_0_1:0.044296,0,miopenConvolutionFwdAlgoGEMM;ConvDirectNaiveConvFwd:39.8573,0,miopenConvolutionFwdAlgoDirect
512-5-64-96-1x1x1-256-5-64-96-1-0x0x0-1x1x1-1x1x1-0-NCDHW-FP16-F=ConvHipImplicitGemm3DGroupFwdXdlops:0.091144,47448064,miopenConvolutionFwdAlgoImplicitGEMM;GemmFwd1x1_0_1:0.0306533,0,miopenConvolutionFwdAlgoGEMM;ConvDirectNaiveConvFwd:29.8993,0,miopenConvolutionFwdAlgoDirect
512-5-66-130-3x3x3-256-3-64-128-1-0x0x0-1x1x1-1x1x1-0-NCDHW-FP16-F=ConvHipImplicitGemm3DGroupFwdXdlops:0.510841,63590400,miopenConvolutionFwdAlgoImplicitGEMM;GemmFwdRest:1.90911,679477248,miopenConvolutionFwdAlgoGEMM;ConvDirectNaiveConvFwd:270.397,0,miopenConvolutionFwdAlgoDirect
512-5-66-130-3x3x3-512-3-64-128-1-0x0x0-1x1x1-1x1x1-0-NCDHW-FP16-F=ConvHipImplicitGemm3DGroupFwdXdlops:0.840297,83251200,miopenConvolutionFwdAlgoImplicitGEMM;GemmFwdRest:2.23481,679477248,miopenConvolutionFwdAlgoGEMM;ConvDirectNaiveConvFwd:269.978,0,miopenConvolutionFwdAlgoDirect
512-5-66-34-3x3x3-512-3-64-32-1-0x0x0-1x1x1-1x1x1-0-NCDHW-FP16-F=ConvHipImplicitGemm3DGroupFwdXdlops:0.276189,31936512,miopenConvolutionFwdAlgoImplicitGEMM;GemmFwdRest:0.72135,169869312,miopenConvolutionFwdAlgoGEMM;ConvDirectNaiveConvFwd:65.5907,0,miopenConvolutionFwdAlgoDirect
512-5-66-50-3x3x3-512-3-64-48-1-0x0x0-1x1x1-1x1x1-0-NCDHW-FP16-F=ConvHipImplicitGemm3DGroupFwdXdlops:0.355909,40488960,miopenConvolutionFwdAlgoImplicitGEMM;GemmFwdRest:0.94683,254803968,miopenConvolutionFwdAlgoGEMM;ConvDirectNaiveConvFwd:102.587,0,miopenConvolutionFwdAlgoDirect
512-5-66-66-3x3x3-512-3-64-64-1-0x0x0-1x1x1-1x1x1-0-NCDHW-FP16-F=ConvHipImplicitGemm3DGroupFwdXdlops:0.519595,49041408,miopenConvolutionFwdAlgoImplicitGEMM;GemmFwdRest:1.18532,339738624,miopenConvolutionFwdAlgoGEMM;ConvDirectNaiveConvFwd:141.187,0,miopenConvolutionFwdAlgoDirect
512-5-66-98-3x3x3-256-3-64-96-1-0x0x0-1x1x1-1x1x1-0-NCDHW-FP16-F=ConvHipImplicitGemm3DGroupFwdXdlops:0.364054,49631232,miopenConvolutionFwdAlgoImplicitGEMM;GemmFwdRest:1.43855,509607936,miopenConvolutionFwdAlgoGEMM;ConvDirectNaiveConvFwd:208.06,0,miopenConvolutionFwdAlgoDirect
512-5-66-98-3x3x3-512-3-64-96-1-0x0x0-1x1x1-1x1x1-0-NCDHW-FP16-F=ConvHipImplicitGemm3DGroupFwdXdlops:0.586105,66146304,miopenConvolutionFwdAlgoImplicitGEMM;GemmFwdRest:1.5088,509607936,miopenConvolutionFwdAlgoGEMM;ConvDirectNaiveConvFwd:201.314,0,miopenConvolutionFwdAlgoDirect
512-5-72-128-1x1x1-256-5-72-128-1-0x0x0-1x1x1-1x1x1-0-NCDHW-FP16-F=ConvHipImplicitGemm3DGroupFwdXdlops:0.143707,71041024,miopenConvolutionFwdAlgoImplicitGEMM;GemmFwd1x1_0_1:0.0458468,0,miopenConvolutionFwdAlgoGEMM;ConvDirectNaiveConvFwd:45.0256,0,miopenConvolutionFwdAlgoDirect
512-5-72-64-1x1x1-256-5-72-64-1-0x0x0-1x1x1-1x1x1-0-NCDHW-FP16-F=ConvHipImplicitGemm3DGroupFwdXdlops:0.076464,35651584,miopenConvolutionFwdAlgoImplicitGEMM;GemmFwd1x1_0_1:0.02776,0,miopenConvolutionFwdAlgoGEMM;ConvDirectNaiveConvFwd:22.5382,0,miopenConvolutionFwdAlgoDirect
512-5-74-130-3x3x3-256-3-72-128-1-0x0x0-1x1x1-1x1x1-0-NCDHW-FP16-F=ConvHipImplicitGemm3DGroupFwdXdlops:0.553231,70488064,miopenConvolutionFwdAlgoImplicitGEMM;GemmFwdRest:2.11759,764411904,miopenConvolutionFwdAlgoGEMM;ConvDirectNaiveConvFwd:302.15,0,miopenConvolutionFwdAlgoDirect
512-5-74-130-3x3x3-512-3-72-128-1-0x0x0-1x1x1-1x1x1-0-NCDHW-FP16-F=ConvHipImplicitGemm3DGroupFwdXdlops:0.906933,91721728,miopenConvolutionFwdAlgoImplicitGEMM;GemmFwdRest:2.50416,764411904,miopenConvolutionFwdAlgoGEMM;ConvDirectNaiveConvFwd:302.67,0,miopenConvolutionFwdAlgoDirect
512-5-74-66-3x3x3-256-3-72-64-1-0x0x0-1x1x1-1x1x1-0-NCDHW-FP16-F=ConvHipImplicitGemm3DGroupFwdXdlops:0.339985,39161856,miopenConvolutionFwdAlgoImplicitGEMM;GemmFwdRest:1.23118,382205952,miopenConvolutionFwdAlgoGEMM;ConvDirectNaiveConvFwd:158.667,0,miopenConvolutionFwdAlgoDirect
512-5-74-66-3x3x3-512-3-72-64-1-0x0x0-1x1x1-1x1x1-0-NCDHW-FP16-F=ConvHipImplicitGemm3DGroupFwdXdlops:0.556412,53317632,miopenConvolutionFwdAlgoImplicitGEMM;GemmFwdRest:1.32234,382205952,miopenConvolutionFwdAlgoGEMM;ConvDirectNaiveConvFwd:158.794,0,miopenConvolutionFwdAlgoDirect
512-5-80-128-1x1x1-256-5-80-128-1-0x0x0-1x1x1-1x1x1-0-NCDHW-FP16-F=ConvHipImplicitGemm3DGroupFwdXdlops:0.13002,78905344,miopenConvolutionFwdAlgoImplicitGEMM;GemmFwd1x1_0_1:0.0491362,0,miopenConvolutionFwdAlgoGEMM;ConvDirectNaiveConvFwd:49.8957,0,miopenConvolutionFwdAlgoDirect
512-5-80-96-1x1x1-256-5-80-96-1-0x0x0-1x1x1-1x1x1-0-NCDHW-FP16-F=ConvHipImplicitGemm3DGroupFwdXdlops:0.1056,59244544,miopenConvolutionFwdAlgoImplicitGEMM;GemmFwd1x1_0_1:0.0362667,0,miopenConvolutionFwdAlgoGEMM;ConvDirectNaiveConvFwd:37.4403,0,miopenConvolutionFwdAlgoDirect
512-5-82-130-3x3x3-256-3-80-128-1-0x0x0-1x1x1-1x1x1-0-NCDHW-FP16-F=ConvHipImplicitGemm3DGroupFwdXdlops:0.574609,77385728,miopenConvolutionFwdAlgoImplicitGEMM;GemmFwdRest:2.3296,849346560,miopenConvolutionFwdAlgoGEMM;ConvDirectNaiveConvFwd:336.889,0,miopenConvolutionFwdAlgoDirect
512-5-82-130-3x3x3-512-3-80-128-1-0x0x0-1x1x1-1x1x1-0-NCDHW-FP16-F=ConvHipImplicitGemm3DGroupFwdXdlops:0.919661,100192256,miopenConvolutionFwdAlgoImplicitGEMM;GemmFwdRest:2.73993,849346560,miopenConvolutionFwdAlgoGEMM;ConvDirectNaiveConvFwd:340.291,0,miopenConvolutionFwdAlgoDirect
512-5-82-98-3x3x3-256-3-80-96-1-0x0x0-1x1x1-1x1x1-0-NCDHW-FP16-F=ConvHipImplicitGemm3DGroupFwdXdlops:0.507945,60018688,miopenConvolutionFwdAlgoImplicitGEMM;GemmFwdRest:1.85213,637009920,miopenConvolutionFwdAlgoGEMM;ConvDirectNaiveConvFwd:260.013,0,miopenConvolutionFwdAlgoDirect
512-5-82-98-3x3x3-512-3-80-96-1-0x0x0-1x1x1-1x1x1-0-NCDHW-FP16-F=ConvHipImplicitGemm3DGroupFwdXdlops:0.778391,78893056,miopenConvolutionFwdAlgoImplicitGEMM;GemmFwdRest:2.21872,637009920,miopenConvolutionFwdAlgoGEMM;ConvDirectNaiveConvFwd:263.062,0,miopenConvolutionFwdAlgoDirect
512-7-130-130-3x3x3-256-5-128-128-1-0x0x0-1x1x1-1x1x1-0-NCDHW-FP16-F=ConvHipImplicitGemm3DGroupFwdXdlops:1.5231,170160128,miopenConvolutionFwdAlgoImplicitGEMM;GemmFwdRest:6.72302,2264924160,miopenConvolutionFwdAlgoGEMM;ConvDirectNaiveConvFwd:894.069,0,miopenConvolutionFwdAlgoDirect
512-7-130-130-3x3x3-512-5-128-128-1-0x0x0-1x1x1-1x1x1-0-NCDHW-FP16-F=ConvHipImplicitGemm3DGroupFwdXdlops:2.68082,219181056,miopenConvolutionFwdAlgoImplicitGEMM;GemmFwdRest:8.48524,2264924160,miopenConvolutionFwdAlgoGEMM;ConvDirectNaiveConvFwd:941.054,0,miopenConvolutionFwdAlgoDirect
512-7-130-66-3x3x3-256-5-128-64-1-0x0x0-1x1x1-1x1x1-0-NCDHW-FP16-F=ConvHipImplicitGemm3DGroupFwdXdlops:0.78323,89550848,miopenConvolutionFwdAlgoImplicitGEMM;GemmFwdRest:3.25029,1132462080,miopenConvolutionFwdAlgoGEMM;ConvDirectNaiveConvFwd:469.534,0,miopenConvolutionFwdAlgoDirect
512-7-130-66-3x3x3-512-5-128-64-1-0x0x0-1x1x1-1x1x1-0-NCDHW-FP16-F=ConvHipImplicitGemm3DGroupFwdXdlops:1.32265,117600256,miopenConvolutionFwdAlgoImplicitGEMM;GemmFwdRest:3.94353,1132462080,miopenConvolutionFwdAlgoGEMM;ConvDirectNaiveConvFwd:470.169,0,miopenConvolutionFwdAlgoDirect
512-7-130-98-3x3x3-256-5-128-96-1-0x0x0-1x1x1-1x1x1-0-NCDHW-FP16-F=ConvHipImplicitGemm3DGroupFwdXdlops:1.03916,129855488,miopenConvolutionFwdAlgoImplicitGEMM;GemmFwdRest:4.83481,1698693120,miopenConvolutionFwdAlgoGEMM;ConvDirectNaiveConvFwd:692.841,0,miopenConvolutionFwdAlgoDirect
512-7-130-98-3x3x3-512-5-128-96-1-0x0x0-1x1x1-1x1x1-0-NCDHW-FP16-F=ConvHipImplicitGemm3DGroupFwdXdlops:1.9531,168390656,miopenConvolutionFwdAlgoImplicitGEMM;GemmFwdRest:6.21984,1698693120,miopenConvolutionFwdAlgoGEMM;ConvDirectNaiveConvFwd:733.179,0,miopenConvolutionFwdAlgoDirect
512-7-18-26-3x3x3-512-5-16-24-1-0x0x0-1x1x1-1x1x1-0-NCDHW-FP16-F=ConvHipImplicitGemm3DGroupFwdXdlops:0.19608,19476480,miopenConvolutionFwdAlgoImplicitGEMM;GemmFwdRest:0.500101,53084160,miopenConvolutionFwdAlgoGEMM;ConvDirectNaiveConvFwd:20.7923,0,miopenConvolutionFwdAlgoDirect
512-7-18-34-3x3x3-512-5-16-32-1-0x0x0-1x1x1-1x1x1-0-NCDHW-FP16-F=ConvHipImplicitGemm3DGroupFwdXdlops:0.21764,21164032,miopenConvolutionFwdAlgoImplicitGEMM;GemmFwdRest:0.526871,70778880,miopenConvolutionFwdAlgoGEMM;ConvDirectNaiveConvFwd:26.5321,0,miopenConvolutionFwdAlgoDirect
512-7-20-18-3x3x3-512-5-18-16-1-0x0x0-1x1x1-1x1x1-0-NCDHW-FP16-F=ConvHipImplicitGemm3DGroupFwdXdlops:0.179712,18210816,miopenConvolutionFwdAlgoImplicitGEMM;GemmFwdRest:0.482673,39813120,miopenConvolutionFwdAlgoGEMM;ConvDirectNaiveConvFwd:15.3124,0,miopenConvolutionFwdAlgoDirect
512-7-20-34-3x3x3-512-5-18-32-1-0x0x0-1x1x1-1x1x1-0-NCDHW-FP16-F=ConvHipImplicitGemm3DGroupFwdXdlops:0.21936,21979136,miopenConvolutionFwdAlgoImplicitGEMM;GemmFwdRest:0.542101,79626240,miopenConvolutionFwdAlgoGEMM;ConvDirectNaiveConvFwd:31.6237,0,miopenConvolutionFwdAlgoDirect
512-7-22-26-3x3x3-512-5-20-24-1-0x0x0-1x1x1-1x1x1-0-NCDHW-FP16-F=ConvHipImplicitGemm3DGroupFwdXdlops:0.21204,20713472,miopenConvolutionFwdAlgoImplicitGEMM;GemmFwdRest:0.521193,66355200,miopenConvolutionFwdAlgoGEMM;ConvDirectNaiveConvFwd:25.9969,0,miopenConvolutionFwdAlgoDirect
512-7-22-34-3x3x3-512-5-20-32-1-0x0x0-1x1x1-1x1x1-0-NCDHW-FP16-F=ConvHipImplicitGemm3DGroupFwdXdlops:0.22002,22794240,miopenConvolutionFwdAlgoImplicitGEMM;GemmFwdRest:0.557948,88473600,miopenConvolutionFwdAlgoGEMM;ConvDirectNaiveConvFwd:34.6984,0,miopenConvolutionFwdAlgoDirect
512-7-34-18-3x3x3-512-5-32-16-1-0x0x0-1x1x1-1x1x1-0-NCDHW-FP16-F=ConvHipImplicitGemm3DGroupFwdXdlops:0.217743,21164032,miopenConvolutionFwdAlgoImplicitGEMM;GemmFwdRest:0.525248,70778880,miopenConvolutionFwdAlgoGEMM;ConvDirectNaiveConvFwd:25.9581,0,miopenConvolutionFwdAlgoDirect
512-7-34-26-3x3x3-512-5-32-24-1-0x0x0-1x1x1-1x1x1-0-NCDHW-FP16-F=ConvHipImplicitGemm3DGroupFwdXdlops:0.22097,24424448,miopenConvolutionFwdAlgoImplicitGEMM;GemmFwdRest:0.590034,106168320,miopenConvolutionFwdAlgoGEMM;ConvDirectNaiveConvFwd:40.0783,0,miopenConvolutionFwdAlgoDirect
512-7-34-34-3x3x3-512-5-32-32-1-0x0x0-1x1x1-1x1x1-0-NCDHW-FP16-F=ConvHipImplicitGemm3DGroupFwdXdlops:0.237927,27684864,miopenConvolutionFwdAlgoImplicitGEMM;GemmFwdRest:0.658955,141557760,miopenConvolutionFwdAlgoGEMM;ConvDirectNaiveConvFwd:54.4457,0,miopenConvolutionFwdAlgoDirect
512-7-34-50-3x3x3-512-5-32-48-1-0x0x0-1x1x1-1x1x1-0-NCDHW-FP16-F=ConvHipImplicitGemm3DGroupFwdXdlops:0.309234,34205696,miopenConvolutionFwdAlgoImplicitGEMM;GemmFwdRest:0.840058,212336640,miopenConvolutionFwdAlgoGEMM;ConvDirectNaiveConvFwd:85.0253,0,miopenConvolutionFwdAlgoDirect
512-7-34-66-3x3x3-512-5-32-64-1-0x0x0-1x1x1-1x1x1-0-NCDHW-FP16-F=ConvHipImplicitGemm3DGroupFwdXdlops:0.453474,40726528,miopenConvolutionFwdAlgoImplicitGEMM;GemmFwdRest:1.05625,283115520,miopenConvolutionFwdAlgoGEMM;ConvDirectNaiveConvFwd:118.248,0,miopenConvolutionFwdAlgoDirect
512-7-38-34-3x3x3-512-5-36-32-1-0x0x0-1x1x1-1x1x1-0-NCDHW-FP16-F=ConvHipImplicitGemm3DGroupFwdXdlops:0.291675,29315072,miopenConvolutionFwdAlgoImplicitGEMM;GemmFwdRest:0.713173,159252480,miopenConvolutionFwdAlgoGEMM;ConvDirectNaiveConvFwd:62.7932,0,miopenConvolutionFwdAlgoDirect
512-7-38-66-3x3x3-512-5-36-64-1-0x0x0-1x1x1-1x1x1-0-NCDHW-FP16-F=ConvHipImplicitGemm3DGroupFwdXdlops:0.488229,43929600,miopenConvolutionFwdAlgoImplicitGEMM;GemmFwdRest:1.16857,318504960,miopenConvolutionFwdAlgoGEMM;ConvDirectNaiveConvFwd:132.381,0,miopenConvolutionFwdAlgoDirect
512-7-42-50-3x3x3-512-5-40-48-1-0x0x0-1x1x1-1x1x1-0-NCDHW-FP16-F=ConvHipImplicitGemm3DGroupFwdXdlops:0.380498,39038976,miopenConvolutionFwdAlgoImplicitGEMM;GemmFwdRest:1.00054,265420800,miopenConvolutionFwdAlgoGEMM;ConvDirectNaiveConvFwd:105.286,0,miopenConvolutionFwdAlgoDirect
512-7-42-66-3x3x3-512-5-40-64-1-0x0x0-1x1x1-1x1x1-0-NCDHW-FP16-F=ConvHipImplicitGemm3DGroupFwdXdlops:0.542097,47132672,miopenConvolutionFwdAlgoImplicitGEMM;GemmFwdRest:1.24288,353894400,miopenConvolutionFwdAlgoGEMM;ConvDirectNaiveConvFwd:147.19,0,miopenConvolutionFwdAlgoDirect
512-7-66-130-3x3x3-256-5-64-128-1-0x0x0-1x1x1-1x1x1-0-NCDHW-FP16-F=ConvHipImplicitGemm3DGroupFwdXdlops:0.802967,89550848,miopenConvolutionFwdAlgoImplicitGEMM;GemmFwdRest:3.26966,1132462080,miopenConvolutionFwdAlgoGEMM;ConvDirectNaiveConvFwd:447.896,0,miopenConvolutionFwdAlgoDirect
512-7-66-130-3x3x3-512-5-64-128-1-0x0x0-1x1x1-1x1x1-0-NCDHW-FP16-F=ConvHipImplicitGemm3DGroupFwdXdlops:1.31416,117600256,miopenConvolutionFwdAlgoImplicitGEMM;GemmFwdRest:3.98761,1132462080,miopenConvolutionFwdAlgoGEMM;ConvDirectNaiveConvFwd:449.475,0,miopenConvolutionFwdAlgoDirect
512-7-66-34-3x3x3-512-5-64-32-1-0x0x0-1x1x1-1x1x1-0-NCDHW-FP16-F=ConvHipImplicitGemm3DGroupFwdXdlops:0.468218,40726528,miopenConvolutionFwdAlgoImplicitGEMM;GemmFwdRest:1.06476,283115520,miopenConvolutionFwdAlgoGEMM;ConvDirectNaiveConvFwd:109.619,0,miopenConvolutionFwdAlgoDirect
512-7-66-50-3x3x3-512-5-64-48-1-0x0x0-1x1x1-1x1x1-0-NCDHW-FP16-F=ConvHipImplicitGemm3DGroupFwdXdlops:0.544774,53538816,miopenConvolutionFwdAlgoImplicitGEMM;GemmFwdRest:1.40043,424673280,miopenConvolutionFwdAlgoGEMM;ConvDirectNaiveConvFwd:171.342,0,miopenConvolutionFwdAlgoDirect
512-7-66-66-3x3x3-512-5-64-64-1-0x0x0-1x1x1-1x1x1-0-NCDHW-FP16-F=ConvHipImplicitGemm3DGroupFwdXdlops:0.77083,66351104,miopenConvolutionFwdAlgoImplicitGEMM;GemmFwdRest:1.65988,566231040,miopenConvolutionFwdAlgoGEMM;ConvDirectNaiveConvFwd:235.431,0,miopenConvolutionFwdAlgoDirect
512-7-66-98-3x3x3-256-5-64-96-1-0x0x0-1x1x1-1x1x1-0-NCDHW-FP16-F=ConvHipImplicitGemm3DGroupFwdXdlops:0.563021,69169152,miopenConvolutionFwdAlgoImplicitGEMM;GemmFwdRest:2.3268,849346560,miopenConvolutionFwdAlgoGEMM;ConvDirectNaiveConvFwd:346.698,0,miopenConvolutionFwdAlgoDirect
512-7-66-98-3x3x3-512-5-64-96-1-0x0x0-1x1x1-1x1x1-0-NCDHW-FP16-F=ConvHipImplicitGemm3DGroupFwdXdlops:0.940139,91975680,miopenConvolutionFwdAlgoImplicitGEMM;GemmFwdRest:2.70603,849346560,miopenConvolutionFwdAlgoGEMM;ConvDirectNaiveConvFwd:343.726,0,miopenConvolutionFwdAlgoDirect
512-7-74-130-3x3x3-256-5-72-128-1-0x0x0-1x1x1-1x1x1-0-NCDHW-FP16-F=ConvHipImplicitGemm3DGroupFwdXdlops:0.871617,99627008,miopenConvolutionFwdAlgoImplicitGEMM;GemmFwdRest:3.63212,1274019840,miopenConvolutionFwdAlgoGEMM;ConvDirectNaiveConvFwd:503.529,0,miopenConvolutionFwdAlgoDirect
512-7-74-130-3x3x3-512-5-72-128-1-0x0x0-1x1x1-1x1x1-0-NCDHW-FP16-F=ConvHipImplicitGemm3DGroupFwdXdlops:1.69973,130297856,miopenConvolutionFwdAlgoImplicitGEMM;GemmFwdRest:4.44699,1274019840,miopenConvolutionFwdAlgoGEMM;ConvDirectNaiveConvFwd:508.766,0,miopenConvolutionFwdAlgoDirect
512-7-74-66-3x3x3-256-5-72-64-1-0x0x0-1x1x1-1x1x1-0-NCDHW-FP16-F=ConvHipImplicitGemm3DGroupFwdXdlops:0.536172,53882880,miopenConvolutionFwdAlgoImplicitGEMM;GemmFwdRest:1.86826,637009920,miopenConvolutionFwdAlgoGEMM;ConvDirectNaiveConvFwd:263.724,0,miopenConvolutionFwdAlgoDirect
512-7-74-66-3x3x3-512-5-72-64-1-0x0x0-1x1x1-1x1x1-0-NCDHW-FP16-F=ConvHipImplicitGemm3DGroupFwdXdlops:0.817733,72757248,miopenConvolutionFwdAlgoImplicitGEMM;GemmFwdRest:2.21986,637009920,miopenConvolutionFwdAlgoGEMM;ConvDirectNaiveConvFwd:264.651,0,miopenConvolutionFwdAlgoDirect
512-7-82-130-3x3x3-256-5-80-128-1-0x0x0-1x1x1-1x1x1-0-NCDHW-FP16-F=ConvHipImplicitGemm3DGroupFwdXdlops:0.896655,109703168,miopenConvolutionFwdAlgoImplicitGEMM;GemmFwdRest:4.03521,1415577600,miopenConvolutionFwdAlgoGEMM;ConvDirectNaiveConvFwd:563.372,0,miopenConvolutionFwdAlgoDirect
512-7-82-130-3x3x3-512-5-80-128-1-0x0x0-1x1x1-1x1x1-0-NCDHW-FP16-F=ConvHipImplicitGemm3DGroupFwdXdlops:1.70805,142995456,miopenConvolutionFwdAlgoImplicitGEMM;GemmFwdRest:4.97121,1415577600,miopenConvolutionFwdAlgoGEMM;ConvDirectNaiveConvFwd:571.108,0,miopenConvolutionFwdAlgoDirect
512-7-82-98-3x3x3-256-5-80-96-1-0x0x0-1x1x1-1x1x1-0-NCDHW-FP16-F=ConvHipImplicitGemm3DGroupFwdXdlops:0.634588,84340736,miopenConvolutionFwdAlgoImplicitGEMM;GemmFwdRest:2.87306,1061683200,miopenConvolutionFwdAlgoGEMM;ConvDirectNaiveConvFwd:433.568,0,miopenConvolutionFwdAlgoDirect
512-7-82-98-3x3x3-512-5-80-96-1-0x0x0-1x1x1-1x1x1-0-NCDHW-FP16-F=ConvHipImplicitGemm3DGroupFwdXdlops:1.09005,111079424,miopenConvolutionFwdAlgoImplicitGEMM;GemmFwdRest:3.51876,1061683200,miopenConvolutionFwdAlgoGEMM;ConvDirectNaiveConvFwd:456.775,0,miopenConvolutionFwdAlgoDirect
512-9-128-128-1x1x1-256-9-128-128-1-0x0x0-1x1x1-1x1x1-0-NCDHW-FP16-F=ConvHipImplicitGemm3DGroupFwdXdlops:0.409091,226754560,miopenConvolutionFwdAlgoImplicitGEMM;GemmFwd1x1_0_1:0.094336,0,miopenConvolutionFwdAlgoGEMM;ConvDirectNaiveConvFwd:146.059,0,miopenConvolutionFwdAlgoDirect
512-9-128-64-1x1x1-256-9-128-64-1-0x0x0-1x1x1-1x1x1-0-NCDHW-FP16-F=ConvHipImplicitGemm3DGroupFwdXdlops:0.17504,113508352,miopenConvolutionFwdAlgoImplicitGEMM;GemmFwd1x1_0_1:0.0678482,0,miopenConvolutionFwdAlgoGEMM;ConvDirectNaiveConvFwd:72.3632,0,miopenConvolutionFwdAlgoDirect
512-9-128-96-1x1x1-256-9-128-96-1-0x0x0-1x1x1-1x1x1-0-NCDHW-FP16-F=ConvHipImplicitGemm3DGroupFwdXdlops:0.330652,170131456,miopenConvolutionFwdAlgoImplicitGEMM;GemmFwd1x1_0_1:0.101887,0,miopenConvolutionFwdAlgoGEMM;ConvDirectNaiveConvFwd:109.124,0,miopenConvolutionFwdAlgoDirect
512-9-64-128-1x1x1-256-9-64-128-1-0x0x0-1x1x1-1x1x1-0-NCDHW-FP16-F=ConvHipImplicitGemm3DGroupFwdXdlops:0.17295,113508352,miopenConvolutionFwdAlgoImplicitGEMM;GemmFwd1x1_0_1:0.068296,0,miopenConvolutionFwdAlgoGEMM;ConvDirectNaiveConvFwd:72.3651,0,miopenConvolutionFwdAlgoDirect
512-9-64-96-1x1x1-256-9-64-96-1-0x0x0-1x1x1-1x1x1-0-NCDHW-FP16-F=ConvHipImplicitGemm3DGroupFwdXdlops:0.139027,85196800,miopenConvolutionFwdAlgoImplicitGEMM;GemmFwd1x1_0_1:0.0528602,0,miopenConvolutionFwdAlgoGEMM;ConvDirectNaiveConvFwd:53.8592,0,miopenConvolutionFwdAlgoDirect
512-9-72-128-1x1x1-256-9-72-128-1-0x0x0-1x1x1-1x1x1-0-NCDHW-FP16-F=ConvHipImplicitGemm3DGroupFwdXdlops:0.1966,127664128,miopenConvolutionFwdAlgoImplicitGEMM;GemmFwd1x1_0_1:0.07952,0,miopenConvolutionFwdAlgoGEMM;ConvDirectNaiveConvFwd:81.3674,0,miopenConvolutionFwdAlgoDirect
512-9-72-64-1x1x1-256-9-72-64-1-0x0x0-1x1x1-1x1x1-0-NCDHW-FP16-F=ConvHipImplicitGemm3DGroupFwdXdlops:0.136594,63963136,miopenConvolutionFwdAlgoImplicitGEMM;GemmFwd1x1_0_1:0.0446133,0,miopenConvolutionFwdAlgoGEMM;ConvDirectNaiveConvFwd:40.4449,0,miopenConvolutionFwdAlgoDirect
512-9-80-128-1x1x1-256-9-80-128-1-0x0x0-1x1x1-1x1x1-0-NCDHW-FP16-F=ConvHipImplicitGemm3DGroupFwdXdlops:0.252256,141819904,miopenConvolutionFwdAlgoImplicitGEMM;GemmFwd1x1_0_1:0.0858668,0,miopenConvolutionFwdAlgoGEMM;ConvDirectNaiveConvFwd:90.777,0,miopenConvolutionFwdAlgoDirect
512-9-80-96-1x1x1-256-9-80-96-1-0x0x0-1x1x1-1x1x1-0-NCDHW-FP16-F=ConvHipImplicitGemm3DGroupFwdXdlops:0.166064,106430464,miopenConvolutionFwdAlgoImplicitGEMM;GemmFwd1x1_0_1:0.0647402,0,miopenConvolutionFwdAlgoGEMM;ConvDirectNaiveConvFwd:68.1521,0,miopenConvolutionFwdAlgoDirect
